status_id,status_message,link_name,status_type,status_link,status_published,num_reactions,num_comments,num_shares,num_likes,num_loves,num_wows,num_hahas,num_sads,num_angrys,date
153080620724_10158200622825725,Just met with General Petraeus--was very impressed!,Timeline Photos,photo,https://www.facebook.com/DonaldTrump/photos/a.488852220724.393301.153080620724/10158200622825725/?type=3,11/28/16 18:23,64331,5126,2871,59261,4243,237,171,27,392,2016-11-28
153080620724_10158199224805725,"Watching the news unfold at Ohio State University. Our thoughts and prayers are with all of the students and administration. Excellent job by the Ohio State University Emergency Management Team (OSU_EMFP) in immediately notifying students & faculty via social media with the message: ""Buckeye Alert: Active Shooter on campus. Run Hide Fight. Watts Hall. 19th and College."" THANK YOU to all FIRST RESPONDERS who reacted immediately and eliminated the threat on campus.",,status,,11/28/16 12:22,173677,6081,14158,155178,7770,471,87,9859,312,2016-11-28
153080620724_10158198392055725,'Trump election points to US growth boost: OECD',Trump election points to US growth boost: OECD,link,https://www.yahoo.com/news/trump-election-points-us-growth-boost-oecd-105313461.html,11/28/16 8:44,25924,2155,2040,23626,1867,282,116,5,28,2016-11-28
153080620724_10158194939630725,"'Trump turns to Washington lawyer to navigate legal, ethics issues'","Trump turns to Washington lawyer to navigate legal, ethics issues",link,http://mobile.reuters.com/article/GCA-us-election-2016/idUSKBN13K26W,11/27/16 15:34,23725,3741,1299,21996,1353,66,227,9,74,2016-11-27
153080620724_10158193831035725,'Priebus: Trump's win biggest since Reagan',Priebus: Trump's win biggest since Reagan,link,http://www.washingtonexaminer.com/priebus-trumps-win-biggest-since-reagan/article/2608212#.WDoEUuuwNdR.twitter,11/27/16 11:00,57148,3960,3490,51620,4687,402,286,24,129,2016-11-27
153080620724_10158191951665725,STATEMENT ON RIDICULOUS GREEN PARTY RECOUNT REQUEST:,Timeline Photos,photo,https://www.facebook.com/DonaldTrump/photos/a.488852220724.393301.153080620724/10158191951665725/?type=3,11/27/16 8:00,106976,12074,16866,97027,5649,354,2926,116,904,2016-11-27
153080620724_10158191877725725,"The Democrats, when they incorrectly thought they were going to win, asked that the election night tabulation be accepted. Not so anymore!",,status,,11/26/16 23:12,170153,16235,11350,147211,4781,878,13925,423,2935,2016-11-26
153080620724_10158189787375725,"Today, the world marks the passing of a brutal dictator who oppressed his own people for nearly six decades. Fidel Castro's legacy is one of firing squads, theft, unimaginable suffering, poverty and the denial of fundamental human rights. While Cuba remains a totalitarian island, it is my hope that today marks a move away from the horrors endured for too long, and toward a future in which the wonderful Cuban people finally live in the freedom they so richly deserve.Though the tragedies, deaths and pain caused by Fidel Castro cannot be erased, our administration will do all it can to ensure the Cuban people can finally begin their journey toward prosperity and liberty. I join the many Cuban Americans who supported me so greatly in the presidential campaign, including the Brigade 2506 Veterans Association that endorsed me, with the hope of one day soon seeing a free Cuba.Donald J. Trump",,status,,11/26/16 13:52,361324,19658,52789,331045,24820,813,2968,239,1439,2016-11-26
153080620724_10158186824555725,KT McFarland has tremendous experience & innate talent..which is crucial because nothing is more important than keeping our people safe. -DJT,Timeline Photos,photo,https://www.facebook.com/DonaldTrump/photos/a.488852220724.393301.153080620724/10158186824555725/?type=3,11/26/16 11:00,46094,4045,2296,42465,3102,79,284,8,156,2016-11-26
153080620724_10158185609480725,'Betsy DeVos's School Mission',Betsy DeVos's School Mission,link,http://www.wsj.com/articles/betsy-devoss-school-mission-1480024466,11/26/16 8:00,26994,3191,2474,24156,1861,114,90,54,719,2016-11-26
153080620724_10158185451440725,"President-Elect Donald J. Trump Selects Kathleen Troia ""KT"" McFarland to Serve as Deputy National Security Advisor and Donald F. McGahn as Assistant to the President and White House Counsel. GreatAgain.gov",,status,,11/25/16 16:10,51157,5276,1972,47476,2985,316,133,25,222,2016-11-25
153080620724_10158184936910725,"We will be ONE NATION. We will be ONE PEOPLE. We will share together - ONE GREAT FUTURE!-DJT",Timeline Photos,photo,https://www.facebook.com/DonaldTrump/photos/a.488852220724.393301.153080620724/10158184936910725/?type=3,11/25/16 14:09,119213,7973,10639,107377,10371,254,884,43,284,2016-11-25
153080620724_10158182032015725,"GREAT NEWS!'Consumer Sentiment in U.S. Jumps After Trump Election Victory'",Consumer Sentiment in U.S. Jumps After Trump Election Victory,link,http://www.bloomberg.com/news/articles/2016-11-23/consumer-sentiment-in-u-s-jumps-after-trump-election-victory,11/25/16 10:00,44811,2965,3522,40788,3366,137,413,15,92,2016-11-25
153080620724_10158182025190725,"TOGETHER, WE WILL MAKE AMERICA GREAT AGAIN! -DJT",Timeline Photos,photo,https://www.facebook.com/DonaldTrump/photos/a.488852220724.393301.153080620724/10158182025190725/?type=3,11/25/16 8:00,77986,4862,2006,71012,5921,110,683,24,236,2016-11-25
153080620724_10158181024740725,"""Today, we give thanks for the many blessings in our lives: family, friends, freedom and faith. From our family to yours Happy Thanksgiving!"" Vice President-elect Mike Pence",Timeline Photos,photo,https://www.facebook.com/DonaldTrump/photos/a.488852220724.393301.153080620724/10158181024740725/?type=3,11/24/16 17:53,125526,4939,5635,115157,9768,85,312,25,179,2016-11-24
153080620724_10158180470195725,"I am working hard, even on Thanksgiving, trying to get Carrier A.C. Company to stay in the U.S. (Indiana). MAKING PROGRESS - Will know soon!",Timeline Photos,photo,https://www.facebook.com/DonaldTrump/photos/a.488852220724.393301.153080620724/10158180470195725/?type=3,11/24/16 15:47,105461,6895,7656,96393,7872,649,344,20,183,2016-11-24
153080620724_10158180334240725,"It is my prayer, that on this Thanksgiving, we begin to heal our divisions and to move forward as one country strengthened by a shared purpose and very, very common resolve. -DJT",Timeline Photos,photo,https://www.facebook.com/DonaldTrump/photos/a.488852220724.393301.153080620724/10158180334240725/?type=3,11/24/16 15:08,75885,3765,5197,67832,7445,127,312,15,154,2016-11-24
153080620724_10158179992525725,Happy Thanksgiving! Hope everyone is having a great day!,Timeline Photos,photo,https://www.facebook.com/DonaldTrump/photos/a.488852220724.393301.153080620724/10158179992525725/?type=3,11/24/16 13:34,225759,15895,6487,205007,18892,210,581,74,995,2016-11-24
153080620724_10158177305505725,"Good morning & Happy Thanksgiving! #ICYMI, please watch & have a wonderful day!",Donald J. Trump,video,https://www.facebook.com/DonaldTrump/videos/10158177217875725/,11/24/16 8:01,153811,10497,11,135806,16972,162,551,46,274,2016-11-24
153080620724_10158177217875725,"Let us give thanks for all that we have, and let us boldly face the exciting new frontiers that lie ahead. Happy Thanksgiving. -DJT",Happy Thanksgiving,video,https://www.facebook.com/DonaldTrump/videos/10158177217875725/,11/23/16 21:06,320413,23239,113937,281287,36187,395,1588,137,819,2016-11-23
153080620724_10158173366930725,"'Trump's White House transition also aims at party unity, mending fences'","Trump's White House transition also aims at party unity, mending fences",link,http://www.foxnews.com/politics/2016/11/21/trumps-white-house-transition-also-aims-at-party-unity-mending-fences.html,11/23/16 16:00,12639,3420,821,11288,1005,34,188,18,106,2016-11-23
153080620724_10158175698130725,"President-Elect Donald J. Trump Intends to Nominate Betsy DeVos as Secretary of the Department of Education(New York, NY) ‰ÛÒ President-elect Donald J. Trump today announced his intent to nominate Betsy DeVos as Secretary of the United States Department of Education. A leader in the national school reform movement for more than two decades, Betsy DeVos is a highly successful education advocate, businesswoman, and philanthropist.""Betsy DeVos is a brilliant and passionate education advocate,"" said President-elect Donald J. Trump. ""Under her leadership we will reform the U.S. education system and break the bureaucracy that is holding our children back so that we can deliver world-class education and school choice to all families. I am pleased to nominate Betsy as Secretary of the Department of Education.""""I am honored to accept this responsibility to work with the President-elect on his vision to make American education great again,"" said Ms. DeVos. ""The status quo in education is not acceptable. Together, we can work to make transformational change that ensures every student in America has the opportunity to fulfill his or her highest potential.""A native of Michigan, Betsy DeVos has spent decades advocating for school choice reforms and helping underserved children gain access to quality education. Ms. DeVos is chairman of the American Federation for Children whose mission is to ""improve our nation's K-12 education by advancing systemic and sustainable public policy that empowers parents, particularly those in low-income families, to choose the education they determine is best for their children.""Ms. DeVos is chair of the Windquest Group and has also served on national and local charitable and civic boards, including the Kennedy Center for the Performing Arts, American Enterprise Institute, The Philanthropy Roundtable, Kids Hope USA, and Mars Hill Bible Church.",Timeline Photos,photo,https://www.facebook.com/DonaldTrump/photos/a.488852220724.393301.153080620724/10158175698130725/?type=3,11/23/16 13:31,53378,6773,4901,48306,3557,209,145,85,1076,2016-11-23
153080620724_10158175434475725,"President-Elect Donald J. Trump Intends to Nominate South Carolina Governor Nikki Haley as U.S. Ambassador to the United Nations(New York, NY) ‰ÛÒ President-elect Donald J. Trump today announced his intent to nominate Governor Nikki Haley (R-SC) as the United States Permanent Representative to the United Nations, a cabinet-level position in the Trump-Pence Administration. Governor Haley is one of the most universally respected governors in the country. After working at her family's business, Governor Haley turned her focus to economic development and has traveled abroad to negotiate with international companies on behalf of South Carolina. As governor, she has led seven overseas trade missions and successfully attracted jobs and investment through negotiations with foreign companies.""Governor Haley has a proven track record of bringing people together regardless of background or party affiliation to move critical policies forward for the betterment of her state and our country,"" said President-elect Trump. ""She is also a proven dealmaker, and we look to be making plenty of deals.  She will be a great leader representing us on the world stage.""""Our country faces enormous challenges here at home and internationally, and I am honored that the President-elect has asked me to join his team and serve the country we love as the next Ambassador to the United Nations,"" said Governor Haley.  Born in Bamberg, South Carolina, the daughter of Indian immigrants, Governor Haley became the first female governor of her home state in 2011 and is currently the youngest governor in the country. Prior to becoming governor, she represented Lexington County in the South Carolina House of Representatives from 2005 to 2011. A true fiscal conservative and savvy businesswoman, Governor Haley's leadership drove down South Carolina's unemployment to a 15 year low by adding more than 82,000 jobs in each of South Carolina's 46 counties.  Prior to dedicating her life to public service, Governor Haley worked at her family business. In 1998, Governor Haley was named to the board of directors of the Orangeburg County Chamber of Commerce and named to the board of directors of the Lexington Chamber of Commerce in 2003. She also became treasurer of the National Association of Women Business Owners in 2003 and president in 2004. Governor Haley is a proud graduate of Clemson University where she earned a degree in accounting. Governor Haley and her husband, Michael, a Captain in the Army National Guard and combat veteran who was deployed to Afghanistan's Helmand Province, have two children, Rena, 18, and Nalin, 15.",,status,,11/23/16 12:10,43605,5139,2573,39426,2846,211,125,69,928,2016-11-23
153080620724_10158172881425725,"It's time to have a new American future! I look forward to beginning on January 20th with Vice President-elect Michael Pence!-DJT",Timeline Photos,photo,https://www.facebook.com/DonaldTrump/photos/a.488852220724.393301.153080620724/10158172881425725/?type=3,11/23/16 10:00,71915,5877,4378,65226,5935,111,392,32,219,2016-11-23
153080620724_10158173363270725,"Thank you! -DJT'Poll: Trump's popularity soars after election'",Poll: Trump's popularity soars after election,link,http://www.politico.com/story/2016/11/donald-trump-popular-poll-231694,11/23/16 8:00,181235,7955,9030,165240,13829,358,1383,82,343,2016-11-23
153080620724_10158172884045725,Bus crash in Tennessee so sad & so terrible. Condolences to all family members and loved ones. These beautiful children will be remembered!,,status,,11/22/16 19:30,237651,7334,12806,182996,13580,252,225,40325,273,2016-11-22
153080620724_10158171423250725,"AS YOUR PRESIDENT, GOVERNMENT CORRUPTION WILL END - and the State Department will answer to YOU, the voters!",,status,,11/22/16 14:15,235772,19955,10880,214567,17363,446,2890,79,427,2016-11-22
153080620724_10158171405530725,"To all law enforcement in America: we are with you, we support you and we will always stand with you. Together, we will create a safe community for every citizen - especially those who have not known safety in a very, very long time. -DJT",Timeline Photos,photo,https://www.facebook.com/DonaldTrump/photos/a.488852220724.393301.153080620724/10158171405530725/?type=3,11/22/16 13:16,167241,6253,20122,149121,16877,241,342,69,591,2016-11-22
153080620724_10158170012145725,Great meetings will take place today at Trump Tower concerning the formation of the people who will run our government for the next 8 years.,,status,,11/22/16 7:21,154803,14211,5321,140280,11031,374,2678,83,357,2016-11-22
153080620724_10158167880720725,,2017 Presidential Transition,video,https://www.facebook.com/Transition2017/videos/1671041513193142/,11/21/16 18:01,179235,16648,27,155275,21586,1235,480,108,551,2016-11-21
153080620724_10158167298790725,Join my 2017 Presidential Transition team here on Facebook! We are working hard everyday - to MAKE AMERICA GREAT AGAIN!,2017 Presidential Transition,link,https://www.facebook.com/Transition2017/,11/21/16 16:00,42546,3612,2,38695,3308,70,280,24,169,2016-11-21
153080620724_10158166788265725,100 DAY PLAN - BEGINNING JANUARY 20th!,Timeline Photos,photo,https://www.facebook.com/DonaldTrump/photos/a.488852220724.393301.153080620724/10158166788265725/?type=3,11/21/16 13:36,157780,9542,15842,142939,12504,409,1594,47,287,2016-11-21
153080620724_10158166077905725,"I like thinking big. If you're going to be thinking anything, you might as well think big! -DJT",Timeline Photos,photo,https://www.facebook.com/DonaldTrump/photos/a.488852220724.393301.153080620724/10158166077905725/?type=3,11/21/16 13:00,105886,4410,7202,97761,7045,158,724,25,173,2016-11-21
153080620724_10158166107140725,"I am going to assemble a team of the best and brightest and put them to work for the American people -- fixing our government and making Washington efficient, effective and responsive.","Trump's White House transition also aims at party unity, mending fences",link,http://www.foxnews.com/politics/2016/11/21/trumps-white-house-transition-also-aims-at-party-unity-mending-fences.html,11/21/16 11:45,117778,8712,5726,107437,8746,282,435,59,819,2016-11-21
153080620724_10158166071295725,"My style of doing things is fairly simple. I just push, push and push again what I want to achieve. -DJT",Timeline Photos,photo,https://www.facebook.com/DonaldTrump/photos/a.488852220724.393301.153080620724/10158166071295725/?type=3,11/21/16 10:46,84528,4597,5451,77658,5720,152,787,21,190,2016-11-21
153080620724_10158162650235725,"'Jeff Sessions, a Fitting Selection for Attorney General'","Jeff Sessions, a Fitting Selection for Attorney General",link,http://www.nationalreview.com/article/442334/jeff-sessions-attorney-general-justice-department-trump-administration,11/20/16 16:41,61662,7118,2472,55584,4620,120,216,94,1028,2016-11-20
153080620724_10158160975940725,I have always had a good relationship with Chuck Schumer. He is far smarter than Harry R and has the ability to get things done. Good news!,,status,,11/20/16 14:00,64741,5703,1456,60306,2621,215,1244,50,305,2016-11-20
153080620724_10158158876145725,Good morning! We are going to show the whole world how proud we are to be American! -DJT,Timeline Photos,photo,https://www.facebook.com/DonaldTrump/photos/a.488852220724.393301.153080620724/10158158876145725/?type=3,11/20/16 11:00,180351,8507,14933,163574,15141,269,966,60,341,2016-11-20
153080620724_10158160050360725,Numerous patriots will be coming to Bedminster today as I continue to fill out the various positions necessary to MAKE AMERICA GREAT AGAIN!,,status,,11/20/16 7:00,115654,7532,2337,107037,7296,152,853,50,266,2016-11-20
153080620724_10158157181845725,Thank you General Flynn. Lets MAKE AMERICA GREAT AGAIN!,Timeline Photos,photo,https://www.facebook.com/DonaldTrump/photos/a.488852220724.393301.153080620724/10158157181845725/?type=3,11/19/16 16:42,83879,5019,3338,76388,6706,122,415,37,211,2016-11-19
153080620724_10158156167810725,"(New York, NY) ‰ÛÒ President-elect Donald J. Trump spoke with the following foreign leaders who have offered their congratulations.‰Û¢Prime Minister of Iraq, Dr. Haider Al-Abadi‰Û¢Secretary General of NATO, Jens Stoltenberg‰Û¢President of European Union Council, Donald Tusk All media requests should be directed to Media@ptt.gov.",,status,,11/19/16 12:34,51167,4713,2329,46560,3561,170,687,21,168,2016-11-19
153080620724_10158155647080725,There is no challenge to great. No dream outside of our reach! -DJT,Timeline Photos,photo,https://www.facebook.com/DonaldTrump/photos/a.488852220724.393301.153080620724/10158155647080725/?type=3,11/19/16 10:36,97358,6219,6779,87968,8331,166,597,31,265,2016-11-19
153080620724_10158152679955725,Will be working all weekend in choosing the great men and women who will be helping to MAKE AMERICA GREAT AGAIN!,,status,,11/18/16 18:38,317461,23235,7921,290664,22756,527,2677,171,666,2016-11-18
153080620724_10158151815505725,#ImWithYou! #AmericaFirst!!,Instagram,link,https://instagram.com/p/BM9y4kvjSmh/,11/18/16 15:52,38145,3237,729,34237,3439,49,263,18,139,2016-11-18
153080620724_10158150838425725,"President-Elect Donald J. Trump Selects U.S. Senator Jeff Sessions for Attorney General, Lt. Gen. Michael Flynn as Assistant to the President for National Security Affairs and U.S. Rep. Mike Pompeo as Director of the Central Intelligence Agency:","President-Elect Donald J. Trump Selects U.S. Senator Jeff Sessions for Attorney General, Lt. Gen. Michael Flynn as Assistant to the President for National Security Affairs and U.S. Rep. Mike Pompeo as Director of the Central Intelligence Agency",link,https://www.greatagain.gov/news/president-elect-donald-j-trump-selects-us-senator-jeff-sessions-attorney-general-lt-gen-michael.html?utm_medium=social&utm_source=twitter&utm_campaign=transitiontw&utm_content&utm_term,11/18/16 11:54,100032,8745,8636,90771,7715,662,188,128,568,2016-11-18
153080620724_10158149133365725,"Received a call last night - from my friend Bill Ford, Chairman of Ford, who advised me that he will be keeping the Lincoln plant in Kentucky - no Mexico.",,status,,11/18/16 7:00,573184,22422,53615,526146,39322,4095,2475,118,1028,2016-11-18
153080620724_10158148014580725,It was a pleasure to have Prime Minister Shinzo Abe stop by my home and begin a great friendship.,Timeline Photos,photo,https://www.facebook.com/DonaldTrump/photos/a.488852220724.393301.153080620724/10158148014580725/?type=3,11/17/16 20:54,329926,11160,17802,308033,17085,2723,1277,106,702,2016-11-17
153080620724_10158146987025725,VP-Elect Michael Pence and I look forward to serving -- and making America safe and great again --- with you! -DJT,Timeline Photos,photo,https://www.facebook.com/DonaldTrump/photos/a.488852220724.393301.153080620724/10158146987025725/?type=3,11/17/16 16:50,99474,6632,5643,89510,9108,225,222,34,375,2016-11-17
153080620724_10158145840470725,"Together we can save American jobs, American lives, and American futures. -DJT",Timeline Photos,photo,https://www.facebook.com/DonaldTrump/photos/a.488852220724.393301.153080620724/10158145840470725/?type=3,11/17/16 11:49,85189,5591,5133,77266,7042,126,477,27,251,2016-11-17
153080620724_10158144843655725,LETS MAKE AMERICA GREAT AGAIN!,Timeline Photos,photo,https://www.facebook.com/DonaldTrump/photos/a.488852220724.393301.153080620724/10158144843655725/?type=3,11/17/16 8:02,296887,15684,73577,267037,26410,975,1994,55,416,2016-11-17
153080620724_10158142547505725,"Together we are going to create real change that puts AMERICA FIRST! -DJT",Timeline Photos,photo,https://www.facebook.com/DonaldTrump/photos/a.488852220724.393301.153080620724/10158142547505725/?type=3,11/16/16 18:30,161825,9432,8346,146667,13332,221,1024,67,514,2016-11-16
153080620724_10158141742040725,"Thank you for your unbelievable support!-DJT","Instagram photo by Donald J. Trump ‰Û¢ Nov 16, 2016 at 8:43pm UTC",link,https://instagram.com/p/BM4oamGj_IW/,11/16/16 15:45,136402,7476,4451,121144,14085,171,595,59,348,2016-11-16
153080620724_10158141273170725,We are going to put AMERICA back to WORK. We are going to put PEOPLE before GOVERNMENT. -DJT,Timeline Photos,photo,https://www.facebook.com/DonaldTrump/photos/a.488852220724.393301.153080620724/10158141273170725/?type=3,11/16/16 13:40,131805,6511,13519,118791,11975,197,614,24,204,2016-11-16
153080620724_10158139877320725,"I am not trying to get ""top level security clearance"" for my children. This was a typically false news story.",,status,,11/16/16 8:05,278807,21168,29253,260747,8256,1025,7543,228,1008,2016-11-16
153080620724_10158138791990725,Very organized process taking place as I decide on Cabinet and many other positions. I am the only one who knows who the finalists are!,,status,,11/16/16 7:15,183054,15660,5353,169509,9825,308,2986,74,352,2016-11-16
153080620724_10158135498775725,"If the election were based on total popular vote I would have campaigned in NY, Florida and California and won even bigger and more easily!",,status,,11/15/16 12:42,293403,20001,19089,257645,17587,632,16406,121,1012,2016-11-15
153080620724_10158135243005725,The forgotten men and women of our country will be forgotten no longer.,Timeline Photos,photo,https://www.facebook.com/DonaldTrump/photos/a.488852220724.393301.153080620724/10158135243005725/?type=3,11/15/16 12:34,139009,5903,10273,123474,14103,228,359,49,796,2016-11-15
153080620724_10158131326495725,I pledge to every citizen in our land that I will be a President for all Americans. Thank you for your support! -DJT,Timeline Photos,photo,https://www.facebook.com/DonaldTrump/photos/a.488852220724.393301.153080620724/10158131326495725/?type=3,11/15/16 7:00,213748,10601,15671,191767,19855,264,1280,61,521,2016-11-15
153080620724_10158131404020725,,Donald J. Trump's cover photo,photo,https://www.facebook.com/DonaldTrump/photos/a.10151443611915725.833012.153080620724/10158131404020725/?type=3,11/14/16 23:46,118133,5825,3538,105344,10781,258,982,91,677,2016-11-14
153080620724_10158130887250725,"We are saddened by the passing of Gwen Ifill and extend our deepest condolences to her family and loved ones. Gwen was a broadcasting pioneer, shattering barriers throughout her career and blazing a path for future generations following in her considerable footsteps. Her presence and legacy will be felt forever.",Timeline Photos,photo,https://www.facebook.com/DonaldTrump/photos/a.488852220724.393301.153080620724/10158130887250725/?type=3,11/14/16 22:58,58799,2424,2663,48214,2067,103,89,8225,101,2016-11-14
153080620724_10158130106010725,"THANK YOU for all of your support on Election Night! Some of you waited 6++ hours, and I appreciated you waiting for us to join you. Together, we will MAKE AMERICA GREAT AGAIN!",Trump Election Headquarters - THANK YOU!,photo,https://www.facebook.com/DonaldTrump/photos/a.10158130105105725.1073741835.153080620724/10158130106010725/?type=3,11/14/16 22:09,115058,4270,3057,100508,13113,198,360,56,823,2016-11-14
153080620724_10158129523585725,Thank you to my amazing family - your support was incredible!,,video,https://www.facebook.com/DonaldTrump/videos/10158129523585725/,11/14/16 19:49,269558,9183,9494,240625,25823,378,657,114,1961,2016-11-14
153080620724_10158127035755725,"A memorable early morning for the MOVEMENT. Working together, we can and will Make America Great Again. Thank you!",Timeline Photos,photo,https://www.facebook.com/DonaldTrump/photos/a.488852220724.393301.153080620724/10158127035755725/?type=3,11/14/16 15:18,74964,4864,1996,65396,8441,156,213,41,717,2016-11-14
153080620724_10158124372910725,"NO DREAM is too big, NO CHALLENGE is too great. Nothing we want for our future is BEYOND OUR REACH.",Timeline Photos,photo,https://www.facebook.com/DonaldTrump/photos/a.488852220724.393301.153080620724/10158124372910725/?type=3,11/14/16 10:59,247223,11074,30542,221839,23184,421,1177,58,544,2016-11-14
153080620724_10158120998180725,Join me - with my entire family tonight on 60 Minutes at 7pmE. Enjoy!,Timeline Photos,photo,https://www.facebook.com/DonaldTrump/photos/a.488852220724.393301.153080620724/10158120998180725/?type=3,11/13/16 18:43,116880,15697,4114,105344,10154,188,644,39,511,2016-11-13
153080620724_10158118812720725,I will be interviewed on @60Minutes tonight after the NFL game - 7:00 P.M. Enjoy!,Timeline Photos,photo,https://www.facebook.com/DonaldTrump/photos/a.488852220724.393301.153080620724/10158118812720725/?type=3,11/13/16 13:30,188195,13694,11006,169892,15347,417,723,75,1741,2016-11-13
153080620724_10158118518780725,Mitt Romney called to congratulate me on the win. Very nice!,,status,,11/13/16 10:48,447244,24637,5419,418178,15250,1516,10895,156,1249,2016-11-13
153080620724_10158114607180725,"Honored to be elected the 45th President of the United States of America. Working together, we will Make America Great Again! -DJT",Timeline Photos,photo,https://www.facebook.com/DonaldTrump/photos/a.488852220724.393301.153080620724/10158114607180725/?type=3,11/12/16 16:59,457577,24747,31871,400442,51334,711,2608,428,2054,2016-11-12
153080620724_10158113356870725,"This will prove to be a great time in the lives of ALL Americans. We will unite and we will win, win, win!",,status,,11/12/16 11:52,505901,30651,17859,456206,41656,636,5101,293,2009,2016-11-12
153080620724_10158107771730725,Today we express our deepest gratitude to all those who have served in our armed forces. #ThankAVet,Timeline Photos,photo,https://www.facebook.com/DonaldTrump/photos/a.488852220724.393301.153080620724/10158107771730725/?type=3,11/11/16 10:26,294929,10359,24240,264549,28429,189,968,81,713,2016-11-11
153080620724_10158104776015725,"Great day in Washington, D.C.  --  thank you!",Timeline Photos,photo,https://www.facebook.com/DonaldTrump/photos/a.488852220724.393301.153080620724/10158104776015725/?type=3,11/10/16 20:38,528439,35365,22303,476359,33154,1263,13887,594,3182,2016-11-10
153080620724_10158102585690725,Happy 241st birthday to the U.S. Marine Corps! Thank you for your service!!,Timeline Photos,photo,https://www.facebook.com/DonaldTrump/photos/a.488852220724.393301.153080620724/10158102585690725/?type=3,11/10/16 12:30,345373,14432,29015,309279,32041,345,683,105,2920,2016-11-10
153080620724_10158097040720725,THANK YOU!,,video,https://www.facebook.com/DonaldTrump/videos/10158097040720725/,11/9/16 14:43,787928,75895,79525,619599,107729,2095,6698,2877,48930,2016-11-09
153080620724_10158096981125725,Such a beautiful and important evening! The forgotten man and woman will never be forgotten again. We will all come together as never before!,,status,,11/9/16 14:32,791584,42918,27232,677299,89610,1044,3372,885,19374,2016-11-09
153080620724_10158093111355725,!,,video,https://www.facebook.com/DonaldTrump/videos/10158093111355725/,11/9/16 2:57,758985,168543,82033,490478,185441,5435,9104,7169,61358,2016-11-09
153080620724_10158092729120725,Thank you Pennsylvania!!,Timeline Photos,photo,https://www.facebook.com/DonaldTrump/photos/a.488852220724.393301.153080620724/10158092729120725/?type=3,11/9/16 2:01,516705,42230,39093,422730,69089,1480,2571,847,19988,2016-11-09
153080620724_10158092047085725,Thank you Georgia!,Timeline Photos,photo,https://www.facebook.com/DonaldTrump/photos/a.488852220724.393301.153080620724/10158092047085725/?type=3,11/9/16 0:34,294399,15301,10842,241846,35811,485,1277,520,14460,2016-11-09
153080620724_10158092040970725,Thank you Iowa!,Timeline Photos,photo,https://www.facebook.com/DonaldTrump/photos/a.488852220724.393301.153080620724/10158092040970725/?type=3,11/9/16 0:34,247024,5298,6810,205547,29208,347,859,344,10719,2016-11-09
153080620724_10158092038410725,Thank you Wisconsin!!,Timeline Photos,photo,https://www.facebook.com/DonaldTrump/photos/a.488852220724.393301.153080620724/10158092038410725/?type=3,11/9/16 0:33,293460,7572,12745,245183,36023,564,956,407,10327,2016-11-09
153080620724_10158091586720725,Thank you Utah!,Timeline Photos,photo,https://www.facebook.com/DonaldTrump/photos/a.488852220724.393301.153080620724/10158091586720725/?type=3,11/8/16 23:23,334817,13354,14032,280256,41002,641,1046,462,11410,2016-11-08
153080620724_10158091465995725,Thank you Florida!,Timeline Photos,photo,https://www.facebook.com/DonaldTrump/photos/a.488852220724.393301.153080620724/10158091465995725/?type=3,11/8/16 23:10,737943,32231,62127,606871,103231,4264,3051,1586,18940,2016-11-08
153080620724_10158091452600725,Thank you Idaho!,Timeline Photos,photo,https://www.facebook.com/DonaldTrump/photos/a.488852220724.393301.153080620724/10158091452600725/?type=3,11/8/16 23:09,326397,5231,13588,275176,40609,430,818,366,8998,2016-11-08
153080620724_10158091450830725,Thank you North Carolina!,Timeline Photos,photo,https://www.facebook.com/DonaldTrump/photos/a.488852220724.393301.153080620724/10158091450830725/?type=3,11/8/16 23:09,367819,8162,20505,306447,49926,643,939,442,9422,2016-11-08
153080620724_10158091172185725,Thank you Ohio!,Timeline Photos,photo,https://www.facebook.com/DonaldTrump/photos/a.488852220724.393301.153080620724/10158091172185725/?type=3,11/8/16 22:34,562385,22921,40981,465819,79180,1399,1758,889,13340,2016-11-08
153080620724_10158091170105725,Thank you Montana!,Timeline Photos,photo,https://www.facebook.com/DonaldTrump/photos/a.488852220724.393301.153080620724/10158091170105725/?type=3,11/8/16 22:34,299098,4574,13787,252116,38123,329,663,275,7592,2016-11-08
153080620724_10158091169000725,Thank you Louisiana!,Timeline Photos,photo,https://www.facebook.com/DonaldTrump/photos/a.488852220724.393301.153080620724/10158091169000725/?type=3,11/8/16 22:34,312699,5878,17353,261981,41929,385,684,277,7443,2016-11-08
153080620724_10158090913005725,Watching the returns at Trump Tower.,Timeline Photos,photo,https://www.facebook.com/DonaldTrump/photos/a.488852220724.393301.153080620724/10158090913005725/?type=3,11/8/16 21:49,434381,30510,14616,372272,50112,673,4719,307,6298,2016-11-08
153080620724_10158090680775725,Thank you Arkansas!!,Timeline Photos,photo,https://www.facebook.com/DonaldTrump/photos/a.488852220724.393301.153080620724/10158090680775725/?type=3,11/8/16 21:15,370031,10094,25129,312049,47375,515,1281,367,8444,2016-11-08
153080620724_10158090569775725,Thank you Texas!!,Timeline Photos,photo,https://www.facebook.com/DonaldTrump/photos/a.488852220724.393301.153080620724/10158090569775725/?type=3,11/8/16 21:05,693002,32360,91715,567064,92118,2132,3070,1726,26892,2016-11-08
153080620724_10158090565755725,Thank you South Dakota!!,Timeline Photos,photo,https://www.facebook.com/DonaldTrump/photos/a.488852220724.393301.153080620724/10158090565755725/?type=3,11/8/16 21:05,326607,4078,16723,278430,40485,400,596,271,6425,2016-11-08
153080620724_10158090551120725,Thank you North Dakota!!,Timeline Photos,photo,https://www.facebook.com/DonaldTrump/photos/a.488852220724.393301.153080620724/10158090551120725/?type=3,11/8/16 21:03,325709,3960,17073,278241,40234,386,601,261,5986,2016-11-08
153080620724_10158090548745725,Thank you Wyoming!!,Timeline Photos,photo,https://www.facebook.com/DonaldTrump/photos/a.488852220724.393301.153080620724/10158090548745725/?type=3,11/8/16 21:03,319888,3990,17982,273155,40047,379,576,240,5491,2016-11-08
153080620724_10158090224665725,Thank you Tennessee!!,Timeline Photos,photo,https://www.facebook.com/DonaldTrump/photos/a.488852220724.393301.153080620724/10158090224665725/?type=3,11/8/16 20:11,429944,10991,40359,364852,55280,528,957,470,7857,2016-11-08
153080620724_10158090223635725,Thank you Oklahoma!!,Timeline Photos,photo,https://www.facebook.com/DonaldTrump/photos/a.488852220724.393301.153080620724/10158090223635725/?type=3,11/8/16 20:11,374151,6395,28415,318157,48043,457,733,351,6410,2016-11-08
153080620724_10158090170170725,Thank you Mississippi!!,Timeline Photos,photo,https://www.facebook.com/DonaldTrump/photos/a.488852220724.393301.153080620724/10158090170170725/?type=3,11/8/16 20:05,368072,5651,29015,313709,46764,462,699,300,6138,2016-11-08
153080620724_10158090138780725,Thank you Missouri!!,Timeline Photos,photo,https://www.facebook.com/DonaldTrump/photos/a.488852220724.393301.153080620724/10158090138780725/?type=3,11/8/16 20:02,411256,7803,42349,350427,51871,584,860,513,7001,2016-11-08
153080620724_10158090100385725,Thank you South Carolina!!,Timeline Photos,photo,https://www.facebook.com/DonaldTrump/photos/a.488852220724.393301.153080620724/10158090100385725/?type=3,11/8/16 19:58,396839,6662,28828,338485,50532,538,726,350,6208,2016-11-08
153080620724_10158089952815725,THANK YOU INDIANA!!,Timeline Photos,photo,https://www.facebook.com/DonaldTrump/photos/a.488852220724.393301.153080620724/10158089952815725/?type=3,11/8/16 19:34,296649,4898,13655,249236,41267,343,523,259,5021,2016-11-08
153080620724_10158089951245725,THANK YOU INDIANA!!,Timeline Photos,photo,https://www.facebook.com/DonaldTrump/photos/a.488852220724.393301.153080620724/10158089951245725/?type=3,11/8/16 19:34,387193,5840,24529,330183,49837,481,741,302,5649,2016-11-08
153080620724_10158089949030725,THANK YOU KENTUCKY!,Timeline Photos,photo,https://www.facebook.com/DonaldTrump/photos/a.488852220724.393301.153080620724/10158089949030725/?type=3,11/8/16 19:34,483794,12333,45633,409792,64630,859,1096,523,6894,2016-11-08
153080620724_10158089677515725,TODAY WE MAKE AMERICA GREAT AGAIN!,,video,https://www.facebook.com/DonaldTrump/videos/10158089677515725/,11/8/16 18:53,204436,48394,19379,150009,46614,545,1714,415,5139,2016-11-08
153080620724_10158088920965725,"Interview with Anthony Scaramucci! TODAY WE MAKE AMERICA GREAT AGAIN!Go to https://vote.gop to find your polling location.",,video,https://www.facebook.com/DonaldTrump/videos/10158088920965725/,11/8/16 16:37,62783,21172,4860,45757,14275,182,596,99,1874,2016-11-08
153080620724_10158088769865725,"Interview with Eric Trump! TODAY WE MAKE AMERICA GREAT AGAIN!Go to https://vote.gop to find your polling location.",,video,https://www.facebook.com/DonaldTrump/videos/10158088769865725/,11/8/16 16:11,68972,17843,5958,51547,14472,186,476,104,2187,2016-11-08
153080620724_10158088606090725,TRUMP TRAIN - GET OUT & VOTE! LETS MAKE AMERCA GREAT AGAIN!!,,video,https://www.facebook.com/DonaldTrump/videos/10158088606090725/,11/8/16 15:47,61142,3400,6967,51966,6681,149,325,46,1975,2016-11-08
153080620724_10158088575475725,TODAY WE MAKE AMERICA GREAT AGAIN!,,video,https://www.facebook.com/DonaldTrump/videos/10158088575475725/,11/8/16 15:47,155807,45498,17899,111486,39660,445,1069,228,2919,2016-11-08
153080620724_10158087703365725,We need your vote. Go to the POLLS! Let's continue this MOVEMENT! Find your polling location: https://vote.gop,,video,https://www.facebook.com/DonaldTrump/videos/10158087703365725/,11/8/16 12:59,182225,15624,17897,159495,18119,200,1939,88,2384,2016-11-08
153080620724_10158086859130725,TODAY WE MAKE AMERICA GREAT AGAIN!,,video,https://www.facebook.com/DonaldTrump/videos/10158086859130725/,11/8/16 11:45,189978,50819,14867,145404,40413,343,1631,167,2020,2016-11-08
153080620724_10158086806115725,VOTE TODAY! Go to https://vote.gop to find your polling location. We are going to Make America Great Again!,,video,https://www.facebook.com/DonaldTrump/videos/10158086806115725/,11/8/16 10:50,197283,13091,19458,169949,23141,162,2141,97,1793,2016-11-08
153080620724_10158085248285725,TODAY WE MAKE AMERICA GREAT AGAIN!,,status,,11/8/16 8:57,1118562,67715,215242,948904,132772,1673,24932,1811,8470,2016-11-08
153080620724_10158082604295725,Today we are going to win the great state of MICHIGAN and we are going to WIN back the White House! Thank you MI! Watch here: https://www.facebook.com/DonaldTrump/videos/10158081600190725/,Timeline Photos,photo,https://www.facebook.com/DonaldTrump/photos/a.488852220724.393301.153080620724/10158082604295725/?type=3,11/8/16 1:44,65806,4032,2255,56277,7749,139,282,26,1333,2016-11-08
153080620724_10158081600190725,"YOU have created a MOVEMENT that will change America. A MOVEMENT that will MAKE AMERICA SAFE AND GREAT AGAIN!I am honored to be here with YOU. Join me LIVE in Grand Rapids, Michigan for my final campaign rally. I will miss these rallies, but tomorrow we have bigger plans. Tomorrow we #DrainTheSwamp! I love you AMERICA!SHARE this post, confirm your polling location at Vote.GOP, and VOTE TOMORROW",,video,https://www.facebook.com/DonaldTrump/videos/10158081600190725/,11/8/16 0:00,205685,272479,74559,131661,63590,1099,2281,712,6342,2016-11-08
153080620724_10158081552880725,"Unbelievable evening in New Hampshire- THANK YOU! Flying to Grand Rapids, Michigan now - see you soon! Everyone get out & VOTE #TrumpPence16 tomorrow. Together, WE will MAKE AMERICA SAFE AND GREAT AGAIN! VOTE.GOP",Timeline Photos,photo,https://www.facebook.com/DonaldTrump/photos/a.488852220724.393301.153080620724/10158081552880725/?type=3,11/7/16 22:49,83186,4938,4223,71965,9486,140,258,24,1313,2016-11-07
153080620724_10158081552880725,"Unbelievable evening in New Hampshire- THANK YOU! Flying to Grand Rapids, Michigan now - see you soon! Everyone get out & VOTE #TrumpPence16 tomorrow. Together, WE will MAKE AMERICA SAFE AND GREAT AGAIN! VOTE.GOP",Timeline Photos,photo,https://www.facebook.com/DonaldTrump/photos/a.488852220724.393301.153080620724/10158081552880725/?type=3,11/7/16 22:49,83186,4938,4223,71965,9486,140,258,24,1313,2016-11-07
153080620724_10158080636820725,"Join me LIVE in Manchester, NH!Be a voter. Learn more >> http://www.Vote.GOPContribute at >> www.DonaldJTrump.com/DrainTheSwamp",,video,https://www.facebook.com/DonaldTrump/videos/10158080636820725/,11/7/16 20:10,406810,613314,128702,254646,129171,2410,4495,1697,14391,2016-11-07
153080620724_10158080275030725,Big news to share in New Hampshire tonight! Polls looking great! See you soon.,,status,,11/7/16 19:23,114562,5121,2767,102444,10591,334,333,29,831,2016-11-07
153080620724_10158080255520725,"Thank you Michigan! Just received poll --- get out and VOTE, VOTE, VOTE!",Timeline Photos,photo,https://www.facebook.com/DonaldTrump/photos/a.488852220724.393301.153080620724/10158080255520725/?type=3,11/7/16 19:23,71131,3698,6642,61496,7726,616,326,69,898,2016-11-07
153080620724_10158080188865725,"Today in Florida, I pledged to stand with the people of Cuba and Venezuela in their fight against oppression, and to help the people of Haiti to recover and rebuild, and to bring jobs and education to all the comunities of Florida -- including Dominicans, Puerto Ricans, Cubans, Venezuelans and all Floridians.",,status,,11/7/16 19:13,123369,4467,9801,111989,9783,159,921,28,489,2016-11-07
153080620724_10158079260770725,"Join me LIVE in Scranton, PA!Be a voter. Learn more >> http://www.Vote.GOPContribute at >> www.DonaldJTrump.com/DrainTheSwamp",,video,https://www.facebook.com/DonaldTrump/videos/10158079260770725/,11/7/16 17:50,192102,231494,40895,128026,56138,936,1860,513,4629,2016-11-07
153080620724_10158079504475725,MAKE AMERICA GREAT AGAIN!,,status,,11/7/16 17:17,585219,22213,69205,512486,61397,647,7431,434,2824,2016-11-07
153080620724_10158079136895725,I love you North Carolina- thank you for your amazing support! Get out and VOTE.GOP tomorrow! Watch: https://www.facebook.com/DonaldTrump/videos/10158078712110725/,Timeline Photos,photo,https://www.facebook.com/DonaldTrump/photos/a.488852220724.393301.153080620724/10158079136895725/?type=3,11/7/16 16:07,85827,3361,6187,74878,9525,167,269,26,962,2016-11-07
153080620724_10158078620255725,LETS MAKE AMERICA GREAT AGAIN!,Timeline Photos,photo,https://www.facebook.com/DonaldTrump/photos/a.488852220724.393301.153080620724/10158078620255725/?type=3,11/7/16 15:00,149925,6925,18850,130807,15809,1509,710,130,960,2016-11-07
153080620724_10158078712110725,"Join me LIVE in Raleigh, NC!Be a voter. Learn more >> http://www.Vote.GOPContribute & Add your name >> www.DonaldJTrump.com/DrainTheSwamp",,video,https://www.facebook.com/DonaldTrump/videos/10158078712110725/,11/7/16 14:53,147977,159726,23027,98974,42423,643,1380,409,4148,2016-11-07
153080620724_10158078606485725,NEW PENNSYLVANIA POLL - THANK YOU! Get out & VOTE!! -DJT,Timeline Photos,photo,https://www.facebook.com/DonaldTrump/photos/a.488852220724.393301.153080620724/10158078606485725/?type=3,11/7/16 14:25,77969,4126,7535,67963,8524,698,269,51,464,2016-11-07
153080620724_10158078308650725,"The only force strong enough to save our country is us. Tomorrow is going to be a wonderful, historic day for our movement -- the day that the American people took back their country. I'm asking you to share our message. Together, we can Make America Great Again for everyone.https://www.youtube.com/watch?v=vST61W4bGm8",Donald Trump's Argument For America,video,https://www.youtube.com/watch?v=vST61W4bGm8,11/7/16 13:56,123750,10996,34780,108876,13099,164,365,71,1175,2016-11-07
153080620724_10158078058530725,"Yesterday we had a HUGE rally in Michigan - 10 MILLION people saw it. These numbers are unheard of. We are going to WIN Michigan and we are going to #DrainTheSwamp.If you missed the rally, you can Watch the LIVE playback here. Be a voter. Learn more >> http://www.Vote.GOPContribute & Add your name >> www.DonaldJTrump.com/DrainTheSwamp",,video,https://www.facebook.com/DonaldTrump/videos/10158078058530725/,11/7/16 12:45,102578,57567,9948,76903,22812,345,698,164,1656,2016-11-07
153080620724_10158077455590725,"Join me LIVE in Sarasota, FL!Be a voter. Learn more >> http://www.Vote.GOPContribute & Add your name >> www.DonaldJTrump.com/DrainTheSwamp",,video,https://www.facebook.com/DonaldTrump/videos/10158077455590725/,11/7/16 11:16,127563,114753,19295,86781,35944,565,1134,300,2839,2016-11-07
153080620724_10158074849735725,Ivanka Trump on her dad as president: 'He will outwork anyone',Ivanka Trump on her dad as president: 'He will outwork anyone',link,https://www.google.com/amp/www.lehighvalleylive.com/articles/19620239/ivanka_trump_tells_lehigh_vall.amp?client=safari,11/7/16 8:30,78923,4594,6014,71392,6827,85,350,11,258,2016-11-07
153080620724_10158075644455725,Incredible rally in Pennsylvania last night. Thank you for all of your support! This is a MOVEMENT like we have never seen before -- and we will never see again. Get out and VOTE tomorrow! It is time to MAKE AMERICA SAFE & GREAT AGAIN!,Daniel Scavino Jr.,video,https://www.facebook.com/DanScavino/videos/1808689232680138/,11/7/16 7:00,97287,5416,3,84321,10500,2037,151,19,259,2016-11-07
153080620724_10158074771180725,"Join me LIVE in Leesburg, VA!Be a voter. Learn more >> http://www.Vote.GOPContribute & Add your name >> www.DonaldJTrump.com/DrainTheSwamp",,video,https://www.facebook.com/DonaldTrump/videos/10158074771180725/,11/7/16 0:13,90798,92431,14607,64021,23745,529,744,188,1571,2016-11-07
153080620724_10158074694395725,"Thank you Pennsylvania- I am forever grateful for your amazing support. Lets MAKE AMERICA GREAT AGAIN! #MAGA VOTE.GOP",Timeline Photos,photo,https://www.facebook.com/DonaldTrump/photos/a.488852220724.393301.153080620724/10158074694395725/?type=3,11/6/16 23:16,87165,4183,7968,76534,8609,1508,163,15,336,2016-11-06
153080620724_10158074011250725,"Join me LIVE in Moon Township, PA!Be a voter. Learn more >> http://www.Vote.GOPContribute & Add your name >> www.DonaldJTrump.com/DrainTheSwamp",,video,https://www.facebook.com/DonaldTrump/videos/10158074011250725/,11/6/16 22:07,133505,157879,24927,89826,38709,648,1255,357,2710,2016-11-06
153080620724_10158072699325725,"Join me LIVE in Sterling Heights, MI!Be a voter. Learn more >> http://www.Vote.GOPContribute & Add your name >> www.DonaldJTrump.com/DrainTheSwamp",,video,https://www.facebook.com/DonaldTrump/videos/10158072699325725/,11/6/16 19:22,218653,372738,57213,146161,63586,1106,2077,694,5029,2016-11-06
153080620724_10158073018665725,"THANK YOU MINNESOTA! It is time to DRAIN THE SWAMP!! Lets MAKE AMERICA GREAT AGAIN - in Michigan now!#ICYMI- watch Minnesota rally here: https://www.facebook.com/DonaldTrump/videos/10158071461455725/",Timeline Photos,photo,https://www.facebook.com/DonaldTrump/photos/a.488852220724.393301.153080620724/10158073018665725/?type=3,11/6/16 18:43,59007,4028,4229,52510,5775,117,118,9,478,2016-11-06
153080620724_10158072146545725,Incredibly touched by this video. Our American comeback story begins November 8th. We will Make America Great Again for everyone.,,video,https://www.facebook.com/DonaldTrump/videos/10158072146545725/,11/6/16 17:30,81573,6578,56721,67807,12402,839,174,99,252,2016-11-06
153080620724_10158071461455725,"Join me LIVE in Minneapolis, MN!Be a voter. Learn more >> http://www.Vote.GOPContribute & Add your name >> www.DonaldJTrump.com/DrainTheSwamp",,video,https://www.facebook.com/DonaldTrump/videos/10158071461455725/,11/6/16 15:18,133941,147189,21376,94557,32940,637,1173,350,4284,2016-11-06
153080620724_10158071199410725,"Thank you Iowa! #VoteTrumpPence16! VOTE.GOP",Timeline Photos,photo,https://www.facebook.com/DonaldTrump/photos/a.488852220724.393301.153080620724/10158071199410725/?type=3,11/6/16 14:28,53881,2804,2569,48608,4619,106,100,13,435,2016-11-06
153080620724_10158070746370725,"Join me LIVE in Sioux City, IA!Be a voter. Learn more >> http://www.Vote.GOPContribute & Add your name >> www.DonaldJTrump.com/DrainTheSwamp",,video,https://www.facebook.com/DonaldTrump/videos/10158070746370725/,11/6/16 13:27,89745,71428,11653,63739,23027,367,664,183,1765,2016-11-06
153080620724_10158070167760725,,Donald J. Trump,video,https://www.facebook.com/DonaldTrump/videos/10158069866980725/,11/6/16 11:58,20260,2230,2,17749,2055,50,75,9,322,2016-11-06
153080620724_10158069866980725,"Only 2 DAYS left! I want to see who is with me during these final days. Show your support & watch your name get added LIVE right here on my Facebook page. I want to see your name!Contribute & Add your name >> www.DonaldJTrump.com/DrainTheSwampFull Speech - Donald Trump Delivers Historic Speech in Gettysburg, PA 10/22/2016",,video,https://www.facebook.com/DonaldTrump/videos/10158069866980725/,11/6/16 11:09,94177,61998,11349,71548,19132,358,736,217,2186,2016-11-06
153080620724_10158069460270725,"Thank you IOWA!! Get out & VOTE AMERICA, and WE will WIN!!",Timeline Photos,photo,https://www.facebook.com/DonaldTrump/photos/a.488852220724.393301.153080620724/10158069460270725/?type=3,11/6/16 9:57,132153,5696,13896,118000,12296,804,446,59,548,2016-11-06
153080620724_10158066779845725,"Join me LIVE in Denver, CO!Be a voter. Learn more >> http://www.Vote.GOPHelp us win. Contribute >> http://www.DonaldJTrump.com/Live",,video,https://www.facebook.com/DonaldTrump/videos/10158066779845725/,11/5/16 23:11,114695,139701,18801,82047,27845,676,1206,303,2618,2016-11-05
153080620724_10158066815435725,,Donald J. Trump,video,https://www.facebook.com/DonaldTrump/videos/10158066540710725/,11/5/16 22:49,16931,2057,2,14978,1529,49,75,6,294,2016-11-05
153080620724_10158066540710725,"Only 2 DAYS left! I want to see who is with me during these final days. Show your support & watch your name get added LIVE right here on my Facebook page. I want to see your name!Contribute & Add your name >> www.DonaldJTrump.com/DrainTheSwampStay tuned. Our final rally of the day -- COLORADO -- Starts at 11:30pmE.",,video,https://www.facebook.com/DonaldTrump/videos/10158066540710725/,11/5/16 22:03,57489,31675,3789,46815,9137,169,556,58,754,2016-11-05
153080620724_10158066484865725,"I would like to thank the United States Secret Service and the law enforcement resources in Reno and the state of Nevada for their fast and professional response. I also want to thank the many thousands of people present for their unwavering and unbelievable support. Nothing will stop us - we will make America great again!Donald J. Trump",,status,,11/5/16 21:24,381146,19066,30013,340623,36843,1793,1010,184,693,2016-11-05
153080620724_10158066284505725,Trump Tower Live Interviews!,,video,https://www.facebook.com/DonaldTrump/videos/10158066284505725/,11/5/16 20:44,36804,17174,3681,28540,7341,130,273,55,465,2016-11-05
153080620724_10158065836440725,"Join me LIVE in Reno, NV!Be a voter. Learn more >> http://www.Vote.GOPHelp us win. Contribute >> http://www.DonaldJTrump.com/Live",,video,https://www.facebook.com/DonaldTrump/videos/10158065836440725/,11/5/16 19:02,138934,177530,28954,95701,36779,1125,1392,482,3455,2016-11-05
153080620724_10158064965940725,DRAIN THE SWAMP!,Homeland Security Committee Chairman Takes Hillary Clinton's Scandal to Highest Level: 'It's Treason',link,http://ijr.com/wildfire/2016/11/729300-homeland-security-committee-chairman-takes-hillary-clintons-scandal-to-highest-level-its-treason/,11/5/16 17:30,87680,5621,21902,78109,4484,922,438,98,3629,2016-11-05
153080620724_10158064925205725,The electoral map is definitely moving in Donald Trump's direction:,The electoral map is definitely moving in Donald Trump's direction,link,https://www.washingtonpost.com/news/the-fix/wp/2016/11/04/dont-look-now-the-electoral-map-is-definitely-moving-in-donald-trumps-direction/,11/5/16 16:43,131364,8259,10550,116600,11959,489,1530,211,575,2016-11-05
153080620724_10158064890070725,'Must Act Immediately': Clinton Charity Lawyer Told Execs They Were Breaking The Law:,'Must Act Immediately': Clinton Charity Lawyer Told Execs They Were Breaking The Law,link,http://dailycaller.com/2016/11/05/must-act-immediately-clinton-charity-lawyer-told-execs-they-were-breaking-the-law/,11/5/16 16:38,24607,1719,4277,19940,320,1512,232,44,2559,2016-11-05
153080620724_10158063340245725,"Together, WE WILL MAKE AMERICA SAFE AND GREAT AGAIN!",Daniel Scavino Jr.,video,https://www.facebook.com/DanScavino/videos/1808017832747278/,11/5/16 11:34,78106,4907,1,67768,9657,323,161,15,182,2016-11-05
153080620724_10158062446180725,Trump seeks uptick in race's final days:,Trump seeks uptick in race's final days,link,http://thehill.com/blogs/ballot-box/presidential-races/304444-trump-seeks-uptick-in-races-final-days,11/5/16 10:15,23315,3026,1005,21166,1776,164,74,11,124,2016-11-05
153080620724_10158062116155725,"Join me LIVE in Tampa, FL!Be a voter. Learn more >> http://www.Vote.GOPHelp us win. Contribute >> http://www.DonaldJTrump.com/Live",,video,https://www.facebook.com/DonaldTrump/videos/10158062116155725/,11/5/16 9:14,139065,150954,24536,96765,36883,790,1497,444,2686,2016-11-05
153080620724_10158062337345725,EVERYONE ---- VOTE!,Timeline Photos,photo,https://www.facebook.com/DonaldTrump/photos/a.488852220724.393301.153080620724/10158062337345725/?type=3,11/5/16 8:41,120444,6520,12669,110387,8927,150,545,26,409,2016-11-05
153080620724_10158059633090725,"Thank you Hershey, Pennsylvania. Get out & VOTE on November 8th & we will #MAGA! #RallyForRiley ‰Û¢ #ICYMI, watch here: http://bit.ly/2fMJnrmHersheyPA",Timeline Photos,photo,https://www.facebook.com/DonaldTrump/photos/a.488852220724.393301.153080620724/10158059633090725/?type=3,11/4/16 21:53,51616,5067,4826,45426,5286,593,97,6,208,2016-11-04
153080620724_10158058056665725,"Join me LIVE in Hershey, PA!Be a voter. Learn more >> www.Vote.GOPHelp us win. Contribute >> www.DonaldJTrump.com/Live",,video,https://www.facebook.com/DonaldTrump/videos/10158058056665725/,11/4/16 18:39,212687,313870,53032,143892,57799,1893,2266,1027,5810,2016-11-04
153080620724_10158058096770725,"On November 8th, EVERYTHING changes. Our movement is about replacing a failed and corrupt political establishment with a new government controlled by you, the American people.The establishment has trillions of dollars at stake in this election.For those who control the levers of power in Washington and for the global special interests, they partner with these people that don't have your good in mind.The political establishment that is trying to stop us is the same group responsible for our disastrous trade deals, massive illegal immigration and economic and foreign policies that have bled our country dry.The political establishment has brought about the destruction of our factories and our jobs as they flee to Mexico, China and other countries all around the world.It's a global power structure that is responsible for the economic decisions that have robbed our working class, stripped our country of its wealth and put that money into the pockets of a handful of large corporations and political entities.The only thing that can stop this corrupt machine is you. The only force strong enough to save our country is us.The only people brave enough to vote out this corrupt establishment is you, the American people.I'm doing this for the people and the movement and we will take back this country for you and we will Make America Great Again.",,video,https://www.facebook.com/DonaldTrump/videos/10158058096770725/,11/4/16 17:41,102382,6830,49648,89569,11386,294,207,42,884,2016-11-04
153080620724_10158055014870725,"Reality Check: ""Hillary Clinton misleads about her 9/11 whereabouts""",Reality Check: Hillary Clinton misleads about her 9/11 whereabouts,link,http://www.cnn.com/2016/11/03/politics/hillary-clinton-reality-check-9-11/index.html?sr=twCNN110316hillary-clinton-reality-check-9-110618PMStoryLink&linkId=30675075,11/4/16 16:30,29344,4274,5031,23264,309,716,1145,128,3782,2016-11-04
153080620724_10158057072840725,,Right Side Broadcasting,video,https://www.facebook.com/rightsidebroadcasting/videos/546068465588531/,11/4/16 15:29,42678,3561,16,35715,6211,119,157,22,454,2016-11-04
153080620724_10158056747520725,"If Obama worked as hard on straightening out our country as he has trying to protect and elect Hillary, we would all be much better off!",,status,,11/4/16 14:08,240174,9419,31629,220366,10712,276,8041,88,691,2016-11-04
153080620724_10158054985395725,"""Donald Trump has never been closer to the presidency than he is at this moment""",Donald Trump has never been closer to the presidency than he is at this moment,link,https://www.google.com/amp/s/www.washingtonpost.com/amphtml/news/the-fix/wp/2016/11/03/donald-trump-has-never-been-closer-to-the-presidency-than-he-is-at-this-moment/?client=safari,11/4/16 13:00,170428,8994,12961,150457,17147,440,1293,301,790,2016-11-04
153080620724_10158055167230725,,Right Side Broadcasting,video,https://www.facebook.com/rightsidebroadcasting/videos/545979655597412/,11/4/16 11:55,31861,2882,9,26967,4454,59,131,12,238,2016-11-04
153080620724_10158054967345725,"""The Clinton Campaign at Obama Justice. Emails on WikiLeaks show a top federal lawyer giving Hillary a quiet heads up.""",The Clinton Campaign at Obama Justice,link,http://www.wsj.com/articles/the-clinton-campaign-at-obama-justice-1478216727,11/4/16 11:30,23922,2772,4708,16021,175,1330,108,127,6161,2016-11-04
153080620724_10158054625440725,4 DAYS ~ GET OUT & VOTE!,Timeline Photos,photo,https://www.facebook.com/DonaldTrump/photos/a.488852220724.393301.153080620724/10158054625440725/?type=3,11/4/16 10:01,87391,5493,10040,79647,6979,114,376,28,247,2016-11-04
153080620724_10158054125305725,"Yesterday we had a historic rally in Selma, NC. More than 17,500 people attended and 7M+ saw it on Facebook. Numbers that are unheard of!If you missed it, watch last night's LIVE broadcast here.We won't win unless you VOTE. Learn more: www.Vote.GOP",,video,https://www.facebook.com/DonaldTrump/videos/10158054125305725/,11/4/16 8:59,119794,42653,17471,94542,22164,1372,571,168,977,2016-11-04
153080620724_10158037582705725,"Together, we will bring the REAL CHANGE we've been waiting for!",,video,https://www.facebook.com/DonaldTrump/videos/10158037582705725/,11/4/16 7:49,56880,3210,11501,51224,5040,96,297,20,203,2016-11-04
153080620724_10158051504535725,"Just informed by the Sheriff - the official number in Selma, North Carolina tonight was 17,500. Thank you!This is an unbelievable MOVEMENT- I am so grateful & thankful for all of your support. TOGETHER, LETS MAKE AMERICA SAFE AND GREAT AGAIN! -DJT",Timeline Photos,photo,https://www.facebook.com/DonaldTrump/photos/a.488852220724.393301.153080620724/10158051504535725/?type=3,11/3/16 20:24,122445,7273,17250,106334,12020,3668,197,32,194,2016-11-03
153080620724_10158050611675725,"Join me LIVE in Selma, NC!Be a voter. Learn more >> www.Vote.GOPHelp us win. Contribute >> www.DonaldJTrump.com/Live",,video,https://www.facebook.com/DonaldTrump/videos/10158050611675725/,11/3/16 18:57,142347,177538,28899,95622,41126,890,1409,521,2779,2016-11-03
153080620724_10158051017510725,"""FBI finds emails related to Hillary Clinton's State Department tenure"" - NEW emails, not duplicates.",FBI finds emails related to Hillary Clinton's State Department tenure,link,http://www.cbsnews.com/news/fbi-finds-emails-related-to-hillary-clintons-state-department-tenure/,11/3/16 18:31,62604,4488,13720,54699,1949,3873,763,71,1249,2016-11-03
153080620724_10158050799260725,"Thank you Fort Collins, Colorado -- love it!","Instagram photo by Donald Trump Jr. ‰Û¢ Nov 3, 2016 at 8:08pm UTC",link,https://instagram.com/p/BMXGGa7DF6y/,11/3/16 17:37,97614,2557,6978,88561,8128,276,489,15,145,2016-11-03
153080620724_10158050145475725,"""Ivanka Trump says father will 'dream big' for U.S.""",Ivanka Trump says father will 'dream big' for U.S.,link,http://www.detroitnews.com/story/news/politics/2016/11/02/ivanka-trump/93219474/,11/3/16 16:30,39176,2217,1931,35627,3272,49,153,6,69,2016-11-03
153080620724_10158050164925725,"Thank you Concord, North Carolina! When WE win on November 8th, we are going to Washington, D.C. and we are going to #DrainTheSwamp!",Timeline Photos,photo,https://www.facebook.com/DonaldTrump/photos/a.488852220724.393301.153080620724/10158050164925725/?type=3,11/3/16 16:12,69162,2807,5621,61990,6241,666,110,9,146,2016-11-03
153080620724_10158049740225725,"Join me LIVE in Concord, NC!Be a voter. Learn more >> www.Vote.GOPHelp us win. Contribute >> www.DonaldJTrump.com/Live",,video,https://www.facebook.com/DonaldTrump/videos/10158049740225725/,11/3/16 14:50,112488,94291,16162,78395,30074,613,1055,309,2042,2016-11-03
153080620724_10158049730075725,,Donald J. Trump,video,https://www.facebook.com/DonaldTrump/videos/10158048880970725/,11/3/16 14:45,11545,1522,0,10404,983,20,36,3,99,2016-11-03
153080620724_10158049620150725,"Watching my beautiful wife, Melania, speak about our love of country and family. We will make you all very proud.",Timeline Photos,photo,https://www.facebook.com/DonaldTrump/photos/a.488852220724.393301.153080620724/10158049620150725/?type=3,11/3/16 14:23,228036,11022,11909,203213,22309,321,1704,45,444,2016-11-03
153080620724_10158048851230725,"Hillary Clinton is under FBI investigation AGAIN. She exposed America's most sensitive secrets, putting our national security at risk. Crooked is UNFIT to serve as our president. When I'm elected, I will PROTECT our people and our country! #AmericaFirst",,video,https://www.facebook.com/DonaldTrump/videos/10158048851230725/,11/3/16 12:56,63090,4388,20593,56168,3600,343,459,67,2453,2016-11-03
153080620724_10158048880970725,"Only 5 DAYS left! I want to see who is with me during these final days. Show your support before 4p ET & watch your name get added LIVE right here on my Facebook page. I want to see your name!Contribute & Add your name >> www.DonaldJTrump.com/DrainTheSwamp",Facebook Live Supporter List #DrainTheSwamp,video,https://www.facebook.com/DonaldTrump/videos/10158048880970725/,11/3/16 12:37,108182,84153,10779,85082,19916,395,1124,182,1483,2016-11-03
153080620724_10158048491275725,,Right Side Broadcasting,video,https://www.facebook.com/rightsidebroadcasting/videos/545519125643465/,11/3/16 11:24,29731,2613,0,25290,4012,68,176,16,169,2016-11-03
153080620724_10158047868030725,Looking at Air Force One at Miami International Airport. Why is he campaigning instead of creating jobs & fixing Obamacare? Get back to work for the American people!,,status,,11/3/16 10:20,199523,17942,33155,175402,7819,756,2870,282,12394,2016-11-03
153080620724_10158047634900725,Thank you Arlene! #ImWithYou!!,94-year old stumps for Trump on foot,link,http://www.wjhg.com/content/news/94-Year-old-goes-the-extra-mile-for-Donald-Trump-399739221.html,11/3/16 9:19,61296,2319,4066,54030,6498,608,79,16,65,2016-11-03
153080620724_10158045105270725,"The FBI is actively and aggressively pursuing and investigating the Clinton Foundation's alleged ""Pay to Play.""","""PAY TO PLAY""",video,https://www.facebook.com/DonaldTrump/videos/10158045105270725/,11/3/16 7:00,69703,5765,23551,62428,3865,912,1866,58,574,2016-11-03
153080620724_10158044750235725,"Unbelievable evening in Pensacola, Florida. Thank you TRUMP TRAIN! Get out and VOTE! Lets MAKE AMERICA SAFE & GREAT AGAIN!",Timeline Photos,photo,https://www.facebook.com/DonaldTrump/photos/a.488852220724.393301.153080620724/10158044750235725/?type=3,11/2/16 20:57,39464,4323,2823,34929,4029,305,73,8,120,2016-11-02
153080620724_10158044205370725,,Fox News,video,https://www.facebook.com/FoxNews/videos/10154757295691336/,11/2/16 18:45,45268,4222,4,38702,5872,106,149,17,422,2016-11-02
153080620724_10158041351735725,"Christians know this election is not just about the next four years, it's about the next FORTY years. We cannot afford to lose the Supreme Court! Thank you Cissie Graham Lynch, daughter of Franklin Graham and granddaughter of Billy Graham, for your support. I will not let you down.",,video,https://www.facebook.com/DonaldTrump/videos/10158041351735725/,11/2/16 18:39,99694,4274,53549,89745,9207,380,133,37,192,2016-11-02
153080620724_10158043519065725,"Thank you Orlando, Florida! We are just six days away from delivering justice for every forgotten man, woman and child in this country!",Timeline Photos,photo,https://www.facebook.com/DonaldTrump/photos/a.488852220724.393301.153080620724/10158043519065725/?type=3,11/2/16 16:32,68550,3998,6223,61194,6091,955,129,15,166,2016-11-02
153080620724_10158042797680725,"Join me LIVE in Orlando, FL!",Right Side Broadcasting,video,https://www.facebook.com/rightsidebroadcasting/videos/545163055679072/,11/2/16 15:09,40893,3554,2,34774,5600,81,189,18,231,2016-11-02
153080620724_10158042402695725,Americans are sick and tired of the pay-to-play politics in Washington. It is time to END Hillary's government corruption and to bring new leadership that puts AMERICA FIRST! #DrainTheSwamp,,video,https://www.facebook.com/DonaldTrump/videos/10158042402695725/,11/2/16 15:00,39531,2759,12399,35610,2051,153,96,55,1566,2016-11-02
153080620724_10158042642970725,Breaking: Hillary Refuses To Release Names Of Donors To Her Foundation As FBI Investigation Deepens:,"COVERUP? Clinton Foundation Fails to Disclose Latest Donor Report, Tax Return",link,http://dailycaller.com/2016/11/02/coverup-clinton-foundation-fails-to-disclose-latest-donor-report-tax-return/,11/2/16 14:33,77726,6811,29998,56797,550,2991,4326,229,12833,2016-11-02
153080620724_10158042290250725,"We are UNITED in our movement to Make America Great Again. Together, we will break free from the rigged system and replace decades of failure with generations of SUCCESS! #ImWithYou",,video,https://www.facebook.com/DonaldTrump/videos/10158042290250725/,11/2/16 13:38,67605,3465,15208,60206,6828,289,114,20,148,2016-11-02
153080620724_10158042059285725,"Thank you Miami! In 6 days, we are going to WIN the GREAT STATE of FLORIDA - and we are going to win back the White House! Get out and VOTE! -DJT",Timeline Photos,photo,https://www.facebook.com/DonaldTrump/photos/a.488852220724.393301.153080620724/10158042059285725/?type=3,11/2/16 12:16,53817,3418,5839,47356,5221,1023,100,7,110,2016-11-02
153080620724_10158041337555725,Praying for the families of the two Iowa police who were ambushed this morning. An attack on those who keep us safe is an attack on us all.,,status,,11/2/16 10:43,139577,3980,13192,114089,5550,135,52,18836,915,2016-11-02
153080620724_10157993493125725,"Crooked launched her political career by letting terrorists off the hook. We must #DrainTheSwamp!http://freebeacon.com/politics/trump-ad-clinton-launched-political-career-pardoning-puerto-rican-terrorists/",,video,https://www.facebook.com/DonaldTrump/videos/10157993493125725/,11/2/16 10:00,22289,2050,5249,18826,629,275,37,257,2265,2016-11-02
153080620724_10158040530965725,"I am going to repeal and replace ObamaCare. We will have MUCH less expensive and MUCH better healthcare. With Hillary, costs will triple!",,status,,11/2/16 8:08,107013,5514,8742,98694,7436,155,487,31,210,2016-11-02
153080620724_10158038949470725,"GOOD MORNING AMERICA! Great new poll coming out of Pennsylvania, thank you!",Timeline Photos,photo,https://www.facebook.com/DonaldTrump/photos/a.488852220724.393301.153080620724/10158038949470725/?type=3,11/2/16 6:00,112003,7781,13394,100255,10191,915,345,44,253,2016-11-02
153080620724_10158038459045725,"Just landed in Florida - join me tomorrow in Miami, Orlando, or Pensacola! We are going to MAKE AMERICA SAFE AT GREAT AGAIN!MIAMI‰Û¢12pmhttps://www.donaldjtrump.com/schedule/register/miami-fl3/ORLANDO‰Û¢4pmhttps://www.donaldjtrump.com/schedule/register/orlando-fl1/PENSACOLA‰Û¢7pmhttps://www.donaldjtrump.com/schedule/register/pensacola-fl3/",Timeline Photos,photo,https://www.facebook.com/DonaldTrump/photos/a.488852220724.393301.153080620724/10158038459045725/?type=3,11/1/16 22:46,79025,5185,9455,72438,6112,79,207,15,174,2016-11-01
153080620724_10158036981695725,"Join me LIVE in Eau Claire, WI!Be a voter. Learn more >> www.Vote.GOPHelp us win. Contribute >> www.DonaldJTrump.com/Live",,video,https://www.facebook.com/DonaldTrump/videos/10158036981695725/,11/1/16 17:57,162296,219412,31933,111338,44752,1017,1710,470,3009,2016-11-01
153080620724_10158036391520725,"Wonderful speech by Peter Thiel yesterday - at The National Press Club in Washington, D.C. Thank you!",,video,https://www.facebook.com/DonaldTrump/videos/10158036391520725/,11/1/16 16:05,35368,3199,11309,32099,2738,333,50,28,120,2016-11-01
153080620724_10158035828865725,Is there anyone with Crooked Hillary that isn't being investigated by the FBI?,The FIVE FBI cases looking at Hillary Clinton's inner circle,video,http://www.dailymail.co.uk/news/article-3889994/Influence-peddling-acting-Putin-s-ally-hiding-classified-secrets-sexting-FIVE-separate-FBI-cases-probing-virtually-one-Clinton-s-inner-circle-families.html,11/1/16 15:15,84044,6573,28101,68896,1243,5299,7040,194,1372,2016-11-01
153080620724_10158035162450725,"So terrible that Crooked didn't report she got the debate questions from Donna Brazile, if that were me it would have been front page news!",,status,,11/1/16 13:39,134036,8180,12741,120831,2440,838,798,324,8805,2016-11-01
153080620724_10158034483755725,"Join me LIVE in Valley Forge, PA!",Right Side Broadcasting,video,https://www.facebook.com/rightsidebroadcasting/videos/544610579067653/,11/1/16 10:54,32499,3709,5,27761,4262,97,85,10,284,2016-11-01
153080620724_10158034198260725,"It's time to #DrainTheSwamp! Crooked Hillary shouldn't even be allowed to run for president!It is time to DREAM BIG and push for BOLD CHANGE! Find out everything you need to know about how to vote below. Let's #MakeAmericaGreatAgain and vote #TrumpPence16!",Vote #TrumpPence16!,link,https://vote.gop/,11/1/16 9:55,39494,3861,3636,36464,2476,58,309,12,175,2016-11-01
153080620724_10158033801955725,"Crooked Hillary should not be allowed to run for president. She deleted 33,000 e-mails AFTER getting a subpoena from U.S. Congress. RIGGED!",,status,,11/1/16 9:15,69122,4285,4091,63737,1873,195,268,55,2994,2016-11-01
153080620724_10158033797345725,Look at the way Crooked Hillary is handling the e-mail case and the total mess she is in. She is unfit to be president. Bad judgement!,,status,,11/1/16 8:37,69145,3888,3280,65016,2677,115,970,35,332,2016-11-01
153080620724_10158030508360725,"""Controversial Dem operative 'close' to Clinton campaign boss, email claims""","Controversial Dem operative 'close' to Clinton campaign boss, email claims",link,http://www.foxnews.com/politics/2016/10/31/controversial-dem-operative-close-to-clinton-campaign-boss-email-claims.html,11/1/16 7:30,13519,1964,1433,10874,145,681,122,32,1665,2016-11-01
153080620724_10158031857550725,In 7 days - America's comeback begins!,Timeline Photos,photo,https://www.facebook.com/DonaldTrump/photos/a.488852220724.393301.153080620724/10158031857550725/?type=3,11/1/16 6:00,108658,4747,19330,98003,9876,161,382,32,204,2016-11-01
153080620724_10158030512570725,It is time to DREAM BIG and push for BOLD CHANGE! #TrumpPence16 ‰Û¢ VOTE.GOP,Timeline Photos,photo,https://www.facebook.com/DonaldTrump/photos/a.488852220724.393301.153080620724/10158030512570725/?type=3,10/31/16 20:33,70691,4540,13171,63296,6868,104,268,12,143,2016-10-31
153080620724_10158027399210725,"Join me LIVE at 4:30pmE in Warren, MI!Stay tuned after the rally for an exclusive interview with Donald Trump Jr. from earlier today.Be a voter. Learn more >> www.Vote.GOPHelp us win. Contribute >> www.DonaldJTrump.com/Live","Join me LIVE at 4:30pmE in Warren, MI!",video,https://www.facebook.com/DonaldTrump/videos/10158027399210725/,10/31/16 15:30,116835,154984,22900,81212,29786,1487,1552,497,2301,2016-10-31
153080620724_10158027399210725,"Join me LIVE at 4:30pmE in Warren, MI!Stay tuned after the rally for an exclusive interview with Donald Trump Jr. from earlier today.Be a voter. Learn more >> www.Vote.GOPHelp us win. Contribute >> www.DonaldJTrump.com/Live","Join me LIVE at 4:30pmE in Warren, MI!",video,https://www.facebook.com/DonaldTrump/videos/10158027399210725/,10/31/16 15:30,116835,154984,22900,81212,29786,1487,1552,497,2301,2016-10-31
153080620724_10158026837515725,#ObamacareFail #HillarycareFail,,video,https://www.facebook.com/DonaldTrump/videos/10158026837515725/,10/31/16 14:11,45781,3946,30110,37023,882,760,405,295,6416,2016-10-31
153080620724_10158026401575725,We raised more than $25 Million online in just one week! RECORD WEEK. We are going to #DrainTheSwamp. Today we will set an even bigger record. Help shatter the record and Contribute in the next hour >> http://bit.ly/final-month,"Donald J. Trump for President, Inc.",link,http://bit.ly/final-month,10/31/16 13:23,20358,1991,799,18300,1655,267,53,4,79,2016-10-31
153080620724_10158023562820725,"Join me LIVE in Grand Rapids, MI!Be a voter. Learn more >> www.Vote.GOPHelp us win. Contribute >> www.DonaldJTrump.com/Live",,video,https://www.facebook.com/DonaldTrump/videos/10158023562820725/,10/31/16 12:22,114591,115859,18982,78982,30409,1056,1448,442,2254,2016-10-31
153080620724_10158025070530725,"Legendary basketball coach Bobby Knight who has 900+ wins, many championships and a gold medal will be introducing me in Michigan shortly.",Timeline Photos,photo,https://www.facebook.com/DonaldTrump/photos/a.488852220724.393301.153080620724/10158025070530725/?type=3,10/31/16 11:46,36492,2044,1578,33414,2713,196,67,6,96,2016-10-31
153080620724_10158023949575725,"In 8 days- the day you have waited for is here. Get out and VOTE! Together, we will MAKE AMERICA SAFE AND GREAT AGAIN! -DJT",Timeline Photos,photo,https://www.facebook.com/DonaldTrump/photos/a.488852220724.393301.153080620724/10158023949575725/?type=3,10/31/16 10:47,48441,2711,3051,43879,4014,134,270,9,135,2016-10-31
153080620724_10158022850390725,Hillary's Two Official Favors To Morocco Resulted In $28 Million For Clinton Foundation:,Hillary's Two Official Favors To Morocco Resulted In $28 Million For Clinton Foundation,link,http://dailycaller.com/2016/10/31/hillarys-two-official-favors-to-morocco-resulted-in-28-million-for-clinton-foundation/,10/31/16 8:33,36629,3809,11546,22566,181,2765,254,280,10583,2016-10-31
153080620724_10158018669815725,"Join me LIVE in Albuquerque, NM!Be a voter. Learn more >> www.Vote.GOPHelp us win. Contribute >> www.DonaldJTrump.com/Live",,video,https://www.facebook.com/DonaldTrump/videos/10158018669815725/,10/30/16 20:08,245068,414395,63114,165109,66139,3258,3328,1245,5989,2016-10-30
153080620724_10158017552765725,"Join me LIVE in Greeley, CO!Be a voter. Learn more >> www.Vote.GOPHelp us win. Contribute >> www.DonaldJTrump.com/Live",,video,https://www.facebook.com/DonaldTrump/videos/10158017552765725/,10/30/16 17:06,145934,175575,24655,99386,40198,1289,1703,534,2824,2016-10-30
153080620724_10158017509400725,Just landed in Colorado. Great news coming out of Florida -- THANK YOU! Get out & VOTE #TrumpPence16! TIME TO MAKE AMERICA SAFE AND GREAT AGAIN!! -DJT,Timeline Photos,photo,https://www.facebook.com/DonaldTrump/photos/a.488852220724.393301.153080620724/10158017509400725/?type=3,10/30/16 16:41,173385,8763,23076,152814,17570,1394,885,124,598,2016-10-30
153080620724_10158015875825725,"Join me LIVE in Las Vegas, NV!Be a voter. Learn more >> www.Vote.GOPHelp us win. Contribute >> www.DonaldJTrump.com/Live",,video,https://www.facebook.com/DonaldTrump/videos/10158015875825725/,10/30/16 12:52,112268,111629,19541,79474,28732,855,1117,382,1708,2016-10-30
153080620724_10158015643820725,,Daniel Scavino Jr.,video,https://www.facebook.com/DanScavino/videos/1805196336362761/,10/30/16 12:30,24375,2107,1,21083,3110,56,64,2,60,2016-10-30
153080620724_10158014789255725,This sign was erected by a 91 year old Holocaust survivor. His first one was stolen so he installed security cameras to watch it - and I will forever be grateful for his support! -DJT,Timeline Photos,photo,https://www.facebook.com/DonaldTrump/photos/a.488852220724.393301.153080620724/10158014789255725/?type=3,10/30/16 11:30,201926,4178,22068,182857,17113,1142,455,75,284,2016-10-30
153080620724_10158012103965725,"VOTE with all of your heart and soul to #MakeAmericaGreatAgain ‰ÛÒ and to Make America JUST Again! VOTE.GOP",Timeline Photos,photo,https://www.facebook.com/DonaldTrump/photos/a.488852220724.393301.153080620724/10158012103965725/?type=3,10/30/16 9:00,76825,3988,8692,70027,6237,105,269,15,172,2016-10-30
153080620724_10158000529885725,Ivanka Trump says her father will move US embassy to Jerusalem '100%' if elected:,Ivanka Trump says her father will move US embassy to Jerusalem '100%' if elected,link,https://urldefense.proofpoint.com/v2/url?u=http-3A__www.jpost.com_US-2DElections_Donald-2DTrump_Ivanka-2DTrump-2Dsays-2Dher-2Dfather-2Dwill-2Dmove-2DUS-2Dembassy-2Dto-2DJerusalem-2D100-2Dpercent-2Dif-2Delected-2D471113&d=DQMGaQ&c=ecx_Oy7LFev-5AZZypfA9UpMsuBfoOoTkgGzbwCI-s8&r=zA9dmLB5U9L85VjiL-J0C9lXwl4miyh5q0o_GMGdzWI&m=yhag5l_Y2gS3uHGa5nNdMq24-Yy83MBnUz0LApYx8cA&s=MIhLWUxz176AtGt5VoWm283UQIY53Lydd-k7ycmwISc&e,10/30/16 7:00,103282,4602,9918,92290,9400,365,938,38,251,2016-10-30
153080620724_10158011331495725,"THANK YOU Phoenix, Arizona! Time for new POWERFUL leadership. Just imagine what WE can accomplish in our first 100 days! #DrainTheSwamp",,video,https://www.facebook.com/DonaldTrump/videos/10158011331495725/,10/29/16 22:22,45361,3460,4335,40602,4158,374,92,10,125,2016-10-29
153080620724_10158009740535725,"Join me LIVE in Phoenix, AZ!  Be a voter. Learn more >> www.Vote.GOPHelp us win. Contribute >> www.DonaldJTrump.com/Live",,video,https://www.facebook.com/DonaldTrump/videos/10158009740535725/,10/29/16 16:52,170684,277088,35355,115727,45939,1909,2135,1543,3431,2016-10-29
153080620724_10158009786015725,So nice - great Americans outside Trump Tower right now. Thank you! (Sorry I am not there - just landed in Arizona!),,video,https://www.facebook.com/DonaldTrump/videos/10158009786015725/,10/29/16 16:47,80077,4098,8355,70908,8051,756,182,15,165,2016-10-29
153080620724_10158007328795725,"Join me LIVE in Golden, CO!Be a voter. Learn more >> www.Vote.GOPHelp us win. Contribute >> www.DonaldJTrump.com/Live",,video,https://www.facebook.com/DonaldTrump/videos/10158007328795725/,10/29/16 12:46,154839,190852,28096,105638,41694,1507,2066,594,3340,2016-10-29
153080620724_10158007350175725,"#WomenForTrump ~ THANK YOU! Together, we will MAKE AMERICA SAFE & GREAT AGAIN! -DJT",Timeline Photos,photo,https://www.facebook.com/DonaldTrump/photos/a.488852220724.393301.153080620724/10158007350175725/?type=3,10/29/16 12:31,51394,2942,3561,45807,5127,111,216,5,128,2016-10-29
153080620724_10158002994100725,LOVE IT ~ THANK YOU for sharing with campaign!,Timeline Photos,photo,https://www.facebook.com/DonaldTrump/photos/a.488852220724.393301.153080620724/10158002994100725/?type=3,10/29/16 9:00,109658,4188,9498,100117,8513,219,494,34,281,2016-10-29
153080620724_10158002756935725,"GET OUT & VOTE - AND TOGETHER, WE WILL MAKE AMERICA GREAT AGAIN!'The artificial intelligence system that has correctly predicted past races says Trump will be our next president'",Reliable AI system predicts Trump will win,link,http://nypost.com/2016/10/28/reliable-ai-system-predicts-trump-will-win/,10/29/16 7:00,78644,5666,6975,70325,7326,227,562,33,171,2016-10-29
153080620724_10158002278355725,"Thank you Maine, New Hampshire and Iowa. The waiting is OVER! The time for change is NOW! We are going to #DrainTheSwamp & #MAGA! #ImWithYou",Timeline Photos,photo,https://www.facebook.com/DonaldTrump/photos/a.488852220724.393301.153080620724/10158002278355725/?type=3,10/28/16 23:19,45007,3291,2941,40241,4291,260,103,7,105,2016-10-28
153080620724_10158001976850725,"""RNC, Trump Campaign Outperforming 2012 Ground game""","RNC, Trump Campaign Outperforming 2012 Ground Game - Breitbart",link,http://www.breitbart.com/2016-presidential-race/2016/10/28/rnc-trump-campaign-outperforming-2012-ground-game/,10/28/16 21:58,23585,1955,1257,21259,2054,124,83,3,62,2016-10-28
153080620724_10158001381385725,RNC on FBI Re-Opening Clinton Investigation: 'Should Be Disqualifying',RNC on FBI Re-Opening Clinton Investigation: 'Should Be Disqualifying' - Breitbart,link,http://www.breitbart.com/2016-presidential-race/2016/10/28/rnc-fbi-re-opening-clinton-investigation-disqualifying/,10/28/16 19:20,107287,9317,16641,97156,6198,641,2723,46,523,2016-10-28
153080620724_10157999534700725,Just came across this story on Donald Trump Jr. in Arizona --- very proud of all my kids. Great job Don Jr.,Trump Jr. helps stranded motorist in Arizona,link,http://www.wptv.com/news/national/democracy-2016/a-stranded-motorist-in-arizona-got-some-unexpected-help-from-donald-trump-jr,10/28/16 15:00,110248,5244,6949,99300,10099,497,273,7,72,2016-10-28
153080620724_10157999264775725,"It is time to DRAIN THE SWAMP in Washington, D.C. It is time to MAKE AMERICA GREAT AGAIN. This begins on November 8th. Get out and VOTE, VOTE, VOTE!",,video,https://www.facebook.com/DonaldTrump/videos/10157999264775725/,10/28/16 13:56,62303,6716,10520,55627,5939,137,329,22,249,2016-10-28
153080620724_10157997937710725,"Join me LIVE in Manchester, NH!Be a voter. Learn more >> www.Vote.GOPHelp us win. Contribute >> www.DonaldJTrump.com/Live",,video,https://www.facebook.com/DonaldTrump/videos/10157997937710725/,10/28/16 12:39,115937,103579,21213,80554,30366,1193,1806,416,1602,2016-10-28
153080620724_10157998450860725,"Just out: Neera Tanden, Hillary Clinton adviser said, ""Israel is depressing."" I think Israel is inspiring!",,status,,10/28/16 12:26,23432,2221,1252,20693,1721,243,76,45,654,2016-10-28
153080620724_10157998404065725,Thank you for your support Bishop Shines!,Breitbart,video,https://www.facebook.com/Breitbart/videos/10157980055595354/,10/28/16 12:14,11580,975,0,10470,999,48,33,2,28,2016-10-28
153080620724_10157997672405725,"It's time to renew our faith in the American Dream and start BELIEVING! #TrumpPence16VOTE.GOP",Timeline Photos,photo,https://www.facebook.com/DonaldTrump/photos/a.488852220724.393301.153080620724/10157997672405725/?type=3,10/28/16 8:56,231750,8007,56410,213113,16731,262,1066,129,449,2016-10-28
153080620724_10157994248895725,"This is a MOVEMENT like NEVER seen before- and will never be seen again. Get out and VOTE! It is time to DRAIN THE SWAMP in Washington, D.C. and put AMERICA FIRST! This is our last chance to MAKE AMERICA SAFE & GREAT AGAIN - I will be your greatest champion! -DJT",Daniel Scavino Jr.,video,https://www.facebook.com/DanScavino/videos/1803621669853561/,10/27/16 21:36,57159,5346,4,50189,5982,583,111,133,161,2016-10-27
153080620724_10157994060645725,"Thank you Geneva, Ohio. If I am elected President, I am going to keep RADICAL ISLAMIC TERRORISTS OUT of our country! #MakeAmericaSafeAgain",Timeline Photos,photo,https://www.facebook.com/DonaldTrump/photos/a.488852220724.393301.153080620724/10157994060645725/?type=3,10/27/16 20:47,48367,3285,4304,43174,4466,488,133,10,96,2016-10-27
153080620724_10157993329265725,"Join me LIVE in Geneva, OH!",,video,https://www.facebook.com/DonaldTrump/videos/10157993329265725/,10/27/16 19:21,112260,121368,18706,80131,27313,643,1006,352,2815,2016-10-27
153080620724_10157993042395725,"Crooked launched her political career by letting terrorists off the hook. #DrainTheSwamphttp://freebeacon.com/politics/trump-ad-clinton-launched-political-career-pardoning-puerto-rican-terrorists/",,video,https://www.facebook.com/DonaldTrump/videos/10157993042395725/,10/27/16 17:54,22446,2165,7286,17771,350,873,70,391,2991,2016-10-27
153080620724_10157992690605725,"I delivered a speech in Charlotte, North Carolina yesterday. I appreciate all of the feedback & support. Lets #MAGA! I love you- and I love this country!http://bit.ly/2eLk8p2Charlotte",,video,https://www.facebook.com/DonaldTrump/videos/10157992690605725/,10/27/16 16:59,54351,3290,14100,48138,5747,235,130,8,93,2016-10-27
153080620724_10157992676315725,"Join me LIVE in Toledo, OH!",,video,https://www.facebook.com/DonaldTrump/videos/10157992676315725/,10/27/16 16:25,69520,45987,9341,51187,16130,325,599,160,1119,2016-10-27
153080620724_10157991985830725,Join me LIVE!,,video,https://www.facebook.com/DonaldTrump/videos/10157991985830725/,10/27/16 16:04,81593,45024,10255,58616,21163,330,609,115,760,2016-10-27
153080620724_10157992086775725,I LOVE YOU OHIO - THANK YOU!,"Instagram photo by Donald J. Trump ‰Û¢ Oct 27, 2016 at 7:27pm UTC",link,https://instagram.com/p/BME_0kqjQWx/,10/27/16 14:28,44362,2640,2391,39728,4227,231,81,4,91,2016-10-27
153080620724_10157991657715725,"Join me LIVE in Springfield, OH!Be a voter. Learn more >> www.Vote.GOPHelp us win. Contribute >> www.DonaldJTrump.com/Live",,video,https://www.facebook.com/DonaldTrump/videos/10157991657715725/,10/27/16 13:07,105089,94202,18172,75533,26059,480,830,274,1913,2016-10-27
153080620724_10157990104410725,"I agree, Michael Moore- To all Americans, I see you & I hear you. I am your voice. Vote to #DrainTheSwamp with me on 11/8!",,video,https://www.facebook.com/DonaldTrump/videos/10157990104410725/,10/27/16 12:12,38833,4656,14976,34153,3505,388,652,11,124,2016-10-27
153080620724_10157989288240725,Oops! Bill Clinton Trashes Obamacare AGAIN!,Oops! Bill Clinton Bashes Failed Obamacare AGAIN (VIDEO),link,http://www.thegatewaypundit.com/2016/10/oops-bill-clinton-bashes-failed-obamacare-video/,10/27/16 12:00,48610,2901,9326,37238,1092,372,9745,29,134,2016-10-27
153080620724_10157989273900725,Mother-Daughter Trump Voters Take MSNBC Reporter To School [VIDEO],Mother-Daughter Trump Voters Take MSNBC Reporter To School [VIDEO],link,http://dailycaller.com/2016/10/26/mother-daughter-trump-voters-take-msnbc-reporter-to-school-video/,10/27/16 11:00,113420,4314,28574,100117,10597,245,2355,18,88,2016-10-27
153080620724_10157989264795725,Inside 'Bill Clinton Inc.': Hacked memo reveals intersection of charity and personal income:,Inside 'Bill Clinton Inc.': Hacked memo reveals intersection of charity and personal income,link,https://www.washingtonpost.com/politics/inside-bill-clinton-inc-hacked-memo-reveals-intersection-of-charity-and-personal-income/2016/10/26/3bf84bba-9b92-11e6-b3c9-f662adaa0048_story.html?hpid=hp_hp-top-table-main_teneowiki815pm%3Ahomepage%2Fstory,10/27/16 10:00,26364,2260,7058,19124,176,1830,223,129,4882,2016-10-27
153080620724_10157989318440725,"I truly believe that we as Americans can accomplish ANYTHING -- and I promise you, if I'm elected, we will once again experience the American Dream! Let's close the history books on the failures in Washington, and let's open a new chapter of success and prosperity for ALL of our people!",,video,https://www.facebook.com/DonaldTrump/videos/10157989318440725/,10/27/16 9:02,87718,4930,20261,78259,8796,142,173,16,332,2016-10-27
153080620724_10157988842065725,"Obamacare is a disaster. We must REPEAL & REPLACE. Tired of the lies, and want to #DrainTheSwamp? Get out & VOTE #TrumpPence16 & lets #MAGA!",,video,https://www.facebook.com/DonaldTrump/videos/10157988842065725/,10/27/16 7:13,40914,3938,10118,36347,1419,125,307,92,2624,2016-10-27
153080620724_10157985862055725,"African-American citizens have sacrificed so much for our nation. They fought and died in every war since the Revolution and from the pews and the picket lines, they've lifted up the conscience of our country in the long march for civil rights. Yet too many African-Americans have been left behind.",Trump promises 'new deal for Black America',link,https://urldefense.proofpoint.com/v2/url?u=http-3A__thehill.com_blogs_ballot-2Dbox_presidential-2Draces_303001-2Dtrump-2Dpromises-2Dnew-2Ddeal-2Dfor-2Dblack-2Damerica&d=DQIF-g&c=ecx_Oy7LFev-5AZZypfA9UpMsuBfoOoTkgGzbwCI-s8&r=zA9dmLB5U9L85VjiL-J0C9lXwl4miyh5q0o_GMGdzWI&m=0K3GP-eShcYje9UoPPh7ZELd3rkOSHFlxqBqgc64Q1o&s=WLYeeStm0genNEAUzIcKGjCfWPtk-J__5SC--IfG9Q8&e,10/26/16 21:57,58758,5285,10720,53941,3906,189,245,82,395,2016-10-26
153080620724_10157985619050725,"Beautiful evening in Kinston, North Carolina - thank you! Get out and VOTE!! You can watch tonight's rally here below! LETS MAKE AMERICA GREAT AGAIN!",Timeline Photos,photo,https://www.facebook.com/DonaldTrump/photos/a.488852220724.393301.153080620724/10157985619050725/?type=3,10/26/16 21:09,35571,2254,2238,32182,3114,112,67,8,88,2016-10-26
153080620724_10157984269835725,"Join me LIVE in Kinston, NC!Be a voter. Learn more >> www.Vote.GOPHelp us win. Contribute >> www.DonaldJTrump.com/Live",,video,https://www.facebook.com/DonaldTrump/videos/10157984269835725/,10/26/16 17:46,227510,390593,55726,159162,58524,1750,2726,778,4570,2016-10-26
153080620724_10157984222705725,So proud of you Ivanka!,,video,https://www.facebook.com/DonaldTrump/videos/10157984222705725/,10/26/16 17:28,61686,3423,2818,55667,5471,108,160,10,270,2016-10-26
153080620724_10157980288935725,"Join me LIVE at 4:00pmE in Charlotte, NC with Live coverage from Trump Tower after the rally.Be a voter. Learn more >> www.Vote.GOPHelp us win. Contribute >> www.DonaldJTrump.com/Live","Join me LIVE at 4:00pmE in Charlotte, NC",video,https://www.facebook.com/DonaldTrump/videos/10157980288935725/,10/26/16 15:46,103974,149151,21224,71059,29007,653,1438,306,1511,2016-10-26
153080620724_10157980288935725,"Join me LIVE at 4:00pmE in Charlotte, NC with Live coverage from Trump Tower after the rally.Be a voter. Learn more >> www.Vote.GOPHelp us win. Contribute >> www.DonaldJTrump.com/Live","Join me LIVE at 4:00pmE in Charlotte, NC",video,https://www.facebook.com/DonaldTrump/videos/10157980288935725/,10/26/16 15:46,103974,149151,21224,71059,29007,653,1438,306,1511,2016-10-26
153080620724_10157979688030725,HAPPY ANNIVERSARY Ivanka & Jared!,"Instagram photo by Donald J. Trump ‰Û¢ Oct 26, 2016 at 3:02pm UTC",link,https://instagram.com/p/BMB8r8dD6H5/,10/26/16 10:03,122557,6117,2250,110951,11061,145,316,16,68,2016-10-26
153080620724_10157979521095725,Get out and VOTE -- we need everyone -- and if you all get to the polls -- we will WIN! Lets MAKE AMERICA GREAT AGAIN!,Timeline Photos,photo,https://www.facebook.com/DonaldTrump/photos/a.488852220724.393301.153080620724/10157979521095725/?type=3,10/26/16 9:24,51528,5120,5264,47182,3901,97,208,10,130,2016-10-26
153080620724_10157976776930725,I will immediately repeal & replace disastrous Obamacare! -DJT,Timeline Photos,photo,https://www.facebook.com/DonaldTrump/photos/a.488852220724.393301.153080620724/10157976776930725/?type=3,10/26/16 7:30,43570,4014,5209,39245,2899,113,701,63,549,2016-10-26
153080620724_10157973074675725,"Join me LIVE at 6:15pmE in Tallahassee, Florida. Thousands will be present.Help us win. Contribute >> www.DonaldJTrump.com/LiveBe a voter. Learn more >> www.Vote.GOP","Join me LIVE at 6:15pmE in Tallahassee, Florida.",video,https://www.facebook.com/DonaldTrump/videos/10157973074675725/,10/25/16 17:26,123502,153407,20999,88103,30866,786,1240,360,2147,2016-10-25
153080620724_10157973074675725,"Join me LIVE at 6:15pmE in Tallahassee, Florida. Thousands will be present.Help us win. Contribute >> www.DonaldJTrump.com/LiveBe a voter. Learn more >> www.Vote.GOP","Join me LIVE at 6:15pmE in Tallahassee, Florida.",video,https://www.facebook.com/DonaldTrump/videos/10157973074675725/,10/25/16 17:26,123502,153407,20999,88103,30866,786,1240,360,2147,2016-10-25
153080620724_10157974492535725,"'Obama Warned Of Rigged Elections In 2008.' Time to #DrainTheSwamphttp://bit.ly/2dGeiObama2008",,video,https://www.facebook.com/DonaldTrump/videos/10157974492535725/,10/25/16 16:04,43217,5418,18833,36982,689,815,2072,82,2577,2016-10-25
153080620724_10157973171305725,"Join me LIVE in Sanford, FL!",,video,https://www.facebook.com/DonaldTrump/videos/10157973171305725/,10/25/16 14:38,229450,275138,47952,158370,58107,1525,3009,850,7589,2016-10-25
153080620724_10157973086795725,Truly honored to receive the first ever presidential endorsement from the Bay of Pigs Veterans Association. #MAGA #ImWithYou,,video,https://www.facebook.com/DonaldTrump/videos/10157973086795725/,10/25/16 13:28,57947,3112,7763,52430,4895,413,73,12,124,2016-10-25
153080620724_10157971847805725,#ObamacareFail,Timeline Photos,photo,https://www.facebook.com/DonaldTrump/photos/a.488852220724.393301.153080620724/10157971847805725/?type=3,10/25/16 12:00,51942,5057,27676,41720,480,676,2538,325,6203,2016-10-25
153080620724_10157971415945725,ObamaCare premiums are about to SKYROCKET -- again. And Crooked H will only make it worse. We will repeal & replace!,Obamacare premiums to soar 22% on average,link,http://money.cnn.com/2016/10/24/news/economy/obamacare-premiums/,10/25/16 10:30,43507,4257,19144,35019,1061,621,174,304,6328,2016-10-25
153080620724_10157971367530725,"Beautiful morning at Trump National - Doral, in Miami, Florida --- with my unbelievable employees. I look forward to putting millions back to work --- across America, as President! -DJT",Timeline Photos,photo,https://www.facebook.com/DonaldTrump/photos/a.488852220724.393301.153080620724/10157971367530725/?type=3,10/25/16 9:26,56252,3564,4096,51143,4661,142,188,8,110,2016-10-25
153080620724_10157967993935725,Thank you Bobby Bowden for the intro last night and your support! I hope I can do as well for Florida as you have done! -DJT,,video,https://www.facebook.com/DonaldTrump/videos/10157967993935725/,10/25/16 7:00,34831,2448,3463,32309,2288,101,52,10,71,2016-10-25
153080620724_10157968108360725,"THANK YOU --- TAMPA, FLORIDA! A beautiful evening --- amazing spirit! Get out and VOTE!",Timeline Photos,photo,https://www.facebook.com/DonaldTrump/photos/a.488852220724.393301.153080620724/10157968108360725/?type=3,10/24/16 21:24,64318,5586,6469,57430,5615,1027,114,16,116,2016-10-24
153080620724_10157966101380725,"Join us LIVE at 6:30pmE! Our nightly campaign coverage from Trump Tower!This is a HISTORIC movement. Together, we will once again make a government by, for, and of the people! Help us close out the final weeks of this campaign strong and WIN.Contribute $10 Now >> www.DonaldJTrump.com/Live",Campaign Coverage - Oct 24,video,https://www.facebook.com/DonaldTrump/videos/10157966101380725/,10/24/16 17:32,161818,203634,41018,111708,42097,1399,2093,648,3873,2016-10-24
153080620724_10157964044755725,'Here's A (Dirty) Laundry List Of The Clinton Foundation's Most Questionable Foreign Donations',Here's A (Dirty) Laundry List Of The Clinton Foundation's Most Questionable Foreign Donations,link,http://dailycaller.com/2016/10/23/heres-a-dirty-laundry-list-of-the-clinton-foundations-most-questionable-foreign-donations/#ixzz4O1G4JZOr,10/24/16 14:00,33648,4315,10580,25738,234,1878,173,158,5467,2016-10-24
153080620724_10157965289060725,"Join me LIVE in St. Augustine, FL!",,video,https://www.facebook.com/DonaldTrump/videos/10157965289060725/,10/24/16 13:49,161003,207336,29748,108295,43322,1163,2344,811,5068,2016-10-24
153080620724_10157965298755725,"THANK YOU to the St. Johns Sheriffs Department - for their support and endorsement this afternoon. I am grateful, and I will not let you down! It is time to MAKE AMERICA SAFE AND GREAT AGAIN!",Timeline Photos,photo,https://www.facebook.com/DonaldTrump/photos/a.488852220724.393301.153080620724/10157965298755725/?type=3,10/24/16 13:42,36693,2015,3300,33554,2895,91,67,6,80,2016-10-24
153080620724_10157964950310725,Join us LIVE right here on my Facebook page - for nightly campaign coverage from Trump Tower! Coverage begins at 6:30pmE!,Timeline Photos,photo,https://www.facebook.com/DonaldTrump/photos/a.488852220724.393301.153080620724/10157964950310725/?type=3,10/24/16 13:25,23463,2102,3620,21333,1882,102,73,7,66,2016-10-24
153080620724_10157964531620725,Thank you - to our Florida Law Enforcement Officers! -DJT,Timeline Photos,photo,https://www.facebook.com/DonaldTrump/photos/a.488852220724.393301.153080620724/10157964531620725/?type=3,10/24/16 12:51,48252,1853,2584,44445,3538,133,75,9,52,2016-10-24
153080620724_10157963068620725,Why has nobody asked Kaine about the horrible views emanated on WikiLeaks about Catholics? Media in the tank for Clinton but Trump will win!,,status,,10/24/16 12:00,58364,4340,3047,54183,2527,152,248,64,1190,2016-10-24
153080620724_10157963998630725,"Departing Farmers Round Table in Boynton Beach, Florida. Get out & VOTE- lets #MAGA! EARLY VOTING BY FL. COUNTY:http://dos.myflorida.com/elections/for-voters/voting/early-voting/",Timeline Photos,photo,https://www.facebook.com/DonaldTrump/photos/a.488852220724.393301.153080620724/10157963998630725/?type=3,10/24/16 10:58,18984,1798,955,17345,1493,66,43,3,34,2016-10-24
153080620724_10157963246615725,STATEMENT ON CLINTON ALLY AIDING WIFE OF TOP FBI OFFICIAL:,SHOW YOUR SUPPORT FOR DONALD TRUMP,link,https://www.donaldjtrump.com/press-releases/statement-on-clinton-ally-aiding-wife-of-top-fbi-official,10/24/16 10:12,40380,2717,4326,36309,2011,1159,118,42,741,2016-10-24
153080620724_10157963064665725,We are winning and the press is refusing to report it. Don't let them fool you- get out and vote! #DrainTheSwamp on November 8th!,Timeline Photos,photo,https://www.facebook.com/DonaldTrump/photos/a.488852220724.393301.153080620724/10157963064665725/?type=3,10/24/16 9:24,184721,11287,59163,168585,13319,479,1883,61,394,2016-10-24
153080620724_10157960403405725,Clinton Ally Aided Campaign of FBI Official's Wife who helped oversee Hillary's email use. Wonder why she's free?,Clinton Ally Aided Campaign of FBI Official's Wife,link,http://www.wsj.com/articles/clinton-ally-aids-campaign-of-fbi-officials-wife-1477266114,10/24/16 7:00,34956,3635,12014,23776,181,2471,155,179,8194,2016-10-24
153080620724_10157958946770725,"Join me LIVE in Naples, FL!",,video,https://www.facebook.com/DonaldTrump/videos/10157958946770725/,10/23/16 16:55,183315,218975,27271,128998,46160,1170,1987,534,4466,2016-10-23
153080620724_10157954599255725,"WikiLeaks: Clinton-Kaine Even Lied About Timing of Veep Pick. Email suggests Kaine knew he was Hillary's choice over a year before feigning surprise:",WikiLeaks: Clinton-Kaine Even Lied About Timing of Veep Pick,link,http://www.lifezette.com/polizette/wikileaks-kaine-clinton-lied-vp-selection/,10/23/16 15:00,39202,6045,8374,29802,210,3746,3193,195,2056,2016-10-23
153080620724_10157957163560725,GET OUT & VOTE ON 11/8/16 -- and WE will WIN! -DJT,Trump leading in poll that has best track record over last three elections,link,http://nypost.com/2016/10/23/trump-leading-in-poll-that-has-best-track-record-over-last-three-elections/,10/23/16 14:30,192736,10299,23978,176298,14107,327,1584,69,351,2016-10-23
153080620724_10157957564840725,Thank you Newt Gingrich - it is time to MAKE AMERICA GREAT AGAIN!,Newt Gingrich,video,https://www.facebook.com/newtgingrich/videos/10154601749879197/,10/23/16 13:01,71399,4036,3,64924,5866,171,172,18,248,2016-10-23
153080620724_10157885740135725,This is not simply another 4-year election. This is a crossroads in the HISTORY of our civilization that will determine whether or not We The People reclaim control over OUR government!,,video,https://www.facebook.com/DonaldTrump/videos/10157885740135725/,10/23/16 11:14,90857,5102,23888,83562,6329,170,191,41,564,2016-10-23
153080620724_10157954540485725,"Yesterday in Gettysburg, Pennsylvania - I unveiled my '100 DAY PLAN.' I want your vote - so we can work together -- at making America great again!",Timeline Photos,photo,https://www.facebook.com/DonaldTrump/photos/a.488852220724.393301.153080620724/10157954540485725/?type=3,10/23/16 6:00,291522,14708,298653,263075,25647,1379,987,60,374,2016-10-23
153080620724_10157953862865725,"I love our supporters -- so much spirit! Thank you Cleveland, Ohio --- VOTE TRUMP/PENCE on 11/8/16. Lets WIN & MAKE AMERICA GREAT AGAIN!",Timeline Photos,photo,https://www.facebook.com/DonaldTrump/photos/a.488852220724.393301.153080620724/10157953862865725/?type=3,10/22/16 21:43,37982,3118,1919,34270,3337,135,99,10,131,2016-10-22
153080620724_10157953690075725,"AMAZING evening in Cleveland, Ohio. Thank you for your incredible support - I will never forget it! -DJT",Timeline Photos,photo,https://www.facebook.com/DonaldTrump/photos/a.488852220724.393301.153080620724/10157953690075725/?type=3,10/22/16 20:50,38637,1906,1531,35195,3102,161,71,6,102,2016-10-22
153080620724_10157952895095725,"Join me LIVE in Cleveland, OH!",,video,https://www.facebook.com/DonaldTrump/videos/10157952895095725/,10/22/16 18:01,146052,208484,30754,101842,38029,992,1753,452,2984,2016-10-22
153080620724_10157952312530725,"Unbelievable crowd of supporters in Virginia Beach, Virginia. Thank you! Next stop - Cleveland, Ohio. #DrainTheSwamp",Timeline Photos,photo,https://www.facebook.com/DonaldTrump/photos/a.488852220724.393301.153080620724/10157952312530725/?type=3,10/22/16 16:11,45739,2886,2312,41297,3895,333,92,8,114,2016-10-22
