status_id,status_message,link_name,status_type,status_link,status_published,num_reactions,num_comments,num_shares,num_likes,num_loves,num_wows,num_hahas,num_sads,num_angrys,date
240944029279128_1381018888604964,"My former campaign manager and current recount manager, David Cobb, will discuss how the 2004 Ohio recount he demanded helped democratize and clean up our voting systems. Find answers to your Recount 2016 questions here: jill2016.com/recountFAQ",David Cobb Updates on 2016 Vote Recount,video,https://www.facebook.com/drjillstein/videos/1381018888604964/,11/28/16 20:59,1076,2920,352,636,314,11,21,5,89,2016-11-28
240944029279128_1380740128632840,"Three-hundred fifty trailblazing women leaders (including me) are gathering in an intimate convention hosted by the National Women's Political Caucus New York City Chapter to strategize the way forward as a united nation of engaged citizens, rather than one divided by partisan politics. Join me: jill2016.com/NYCWomen",RSVP for National Women's Political Caucus New York City Chapter Convention,link,http://www.jill2016.com/NYCWomen,11/28/16 19:00,626,271,85,503,80,4,7,1,31,2016-11-28
240944029279128_1380664685307051,"One of our election integrity advisors Bob Fitrakis co-wrote this article:""Hillary Clinton's margin of victory in the 2016 vote count continues to climb, at this point well over a million. But her impending defeat in the Electoral College comes with familiar signs that the election was stripped and flipped.These indicators include the realities of pre- and post-election polling; the massive stripping of primarily black, Hispanic and Asian-American voters from computer generated registration rolls mostly maintained by private partisan companies; unverifiable ""black box"" electronic voting machines and central tabulators, also mostly manufactured and maintained by private corporations, and much more.Were this election held in any other country, the US State Department and independent monitors from around the world would denounce it as a fraud, and contemplate international intervention. The Electoral CollegeMuch is finally being said about the Electoral College, with new popular demands for its abolition. Clinton is about to become the sixth presidential candidate to win a traditional majority but lose the presidency. It also happened in 1800, 1824, 1876, 1888 and 2000. Nearly 15% of our 45 presidents have been ""selected"" with the denial of the public will through an institution established in large part to enhance the power of slaveowners.In February, 2013, at progressive.org, we joined the multitudes throughout our history in calling for the EC's abolition:It will take a Constitutional Amendment, and a hell of a lot of work, to abolish this corrupt anachronism. But unless we want to see an endless succession of George W. Bushes in the White House, something better be done -- and quick.The consequences of inaction are all too clear.Computerized Jim Crow Stripping of Voter Registration RollsUS history has been defined throughout by a divide-and-conquer strategy of racial manipulation. As we outline in our new Strip & Flip Death of American Democracy (freepress.org / solartopia.org): chattel slavery, the Constitution's ""three-fifths bonus,"" Jim Crow segregation, third world imperial conquest and the Drug War have all played a role in denying African-American/Hispanic/Asian-American citizens their right to vote. From the foundation of the Republic, this disenfranchisement has defined the balance of power.In recent years, the disenfranchisement has been most importantly done by the Republican Party, and by computer. As investigative reporter Greg Palast has shown in his book/movie The Best Democracy Money Can Buy (www.gregpalast.com) in 2000 Florida Governor Jeb Bush used a program called ChoicePoint to strip more than 90,000 predominantly black and Hispanic citizens from the voter registration rolls in an election decided by 537 votes. The pretext was alleged felony convictions. The selection was ""won"" by Bush's brother George W although a full recount (which was stopped by the US Supreme Court by one vote) would have given Al Gore the majority in Florida, and in the Electoral College.As we have reported from Columbus, in 2004 more than 300,000 predominantly urban citizens were stripped from the voter registration rolls in an election the GOP won by 118,775. A quarter of all voters in heavily Democratic Cleveland were de-registered. Ohio's ill-got electoral votes gave George W. Bush a second term. This became the only time in US history an entire state's Electoral College delegation was challenged on the floor of the US Congress.This year, Palast has reported that a new program called Crosscheck has been used by some 30 GOP Secretaries of State to strip more than 1.1 million predominantly black, Hispanic, Islamic and Asian-American citizens from the voter rolls.Originating with far-right Republican Kris Kobach, Kansas's Secretary of State, Crosscheck eliminated more than enough minority voters in at least three swing states to flip the entire presidential election.Palast has reported Ohio's GOP Secretary of State Jon Husted also used Crosscheck to eliminate some 497,000 mostly black, Latino and African-American citizens from the voter rolls in Ohio, falsely accusing them of registering in more than one state. Such eliminations went on throughout the US and may have involved more than a million legitimate voters.According to Reuters, over the past five years Husted himself stripped some two million citizens from the voter rolls in Ohio without Crosscheck, with Democratic areas twice as likely to be striped as Republicans. Reuters points out that the neighborhoods that most heavily backed President Obama lost the most voters.The mass disenfranchisement also impacted races for the US Senate. At least four Democrats would likely have won seats (in Florida, Pennsylvania, Wisconsin and Missouri) that they officially lost (www.tdmsresearch.com. Similar results are evident from 2014 Senate races in North Carolina, Colorado and Alaska. Thus in the past two years, mass disenfranchisement and computerized vote stripping may well have stripped seven Upper House seats from the Democrats to the GOP.Thus the electronic race-based stripping of voter rolls in the GOP's favor has probably on its own taken to the far right the presidency, control of the US Senate and ultimately the US Supreme Court.It should be noted that out of disgust with Donald Trump, the GOP multi-billionaire Koch Brothers shifted much of their massive financial weight from the presidential race to Congressional and other ""down-ballot contests,"" where these key Senate seats and others in the US House and state governments were almost certainly impacted.Traditional Jim Crow Stripping of Voter Registration RollsAlongside computerized techniques, the Republicans have effectively deployed still more traditional Jim Crow tactics to strip black/Hispanic/Asian-American citizens of their ability to vote. In part these include: demands for photo ID, elimination of polling places, narrowing time frames in which citizens can vote, deliberate distribution of misinformation about voting requirements, non-counting of provisional ballots, failure to send out absentee ballots, intimidation and widespread confusion at polling places [Google voting map] and much more.In its 2013 Shelby County vs. Holder decision, the US Supreme Court gutted protections provided by the 1965 Voting Rights Act, opening the floodgates for Jim Crow abuse throughout the electoral system.Numerous reports indicate that citizens were often confronted with photo ID requirements even where they were voided by the courts. As in Ohio 2004, reports indicate many citizens were directed by official websites to polling places that did not actually exist.  This year Ohio Secretary of State Jon Husted failed to distribute more than 1,050,000 absentee ballot applications to citizens entitled to them. On Election Day, media throughout the US reported the kinds of mass delays and confusion that defined the elections of 2000 and 2004.  Said the New York Times: ""Voters nationwide endured long waits in line, malfunctioning voting machines, ill-informed poll workers and a litany of lesser annoyances on Tuesday with scattered reports that some voters gave up trying to cast ballots.""David Becker, the Executive Director of the Center for Election Innovation, told the Times, ""There are scattered indications of machine breakdowns that are being addressed.""In an editorial the day after the election, the Times lamented that in North Carolina ""The state's Republican Party issued a news release boasting that cutbacks in early voting hours reduced black turnout by 8.5% below 2012 levels, even as the numbers of white early voters increased by 22.5%."" Fourteen states put in new voting restrictions including some states that were never under federal supervision like Indiana, Ohio and Wisconsin. Throughout the US, voters with ""problems"" in their registration are routinely given provisional ballots, allegedly to be counted later. But the forms are often impossibly complex, with poll workers often failing to count them at the sight of a single minor error, such as writing below a line, omitting a middle initial, failing to include a birthday and much more. Ohio Secretary of State Husted won the right from the US Sixth Circuit Court of Appeals to not count prevision ballots that contain a minor mistake. Thus tens of thousands of provisional ballots are thus routinely left uncounted, unbeknownst to the voters. More than 115,000 provisional and ""spoiled"" ballots from the Ohio 2004 election remain uncounted.Polling IndicatorsIn the lead-up to November 8, pre-election polls strongly indicated a Clinton victory. Post-Election exit polls showed her winning as well, most critically in the swing states whose Electoral College votes could give her the presidency.Exit polls are the accepted international standard for indications of election fraud and vote tampering. Eric Bjornlund and Glenn Cowan's 2011 pamphlet ""Vote Count Verification: a User's Guide for Funders, Implementers and Stakeholders."" Their work, done under the auspices of Democracy International for the US Agency for International Development (USAID), outlines how exit polling is used to ensure free and fair elections.It adds that ""U.S-funded organizations have sponsored exit polls as part of democracy assistance programs in Macedonia (2005), Afghanistan (2004), Ukraine (2004), Azerbaijan (2005), the West Bank and Gaza Strip (2005), Lebanon (2005), Kazakhstan (2005), Kenya (2005, 2007), and Bangladesh (2009), among other places.""In countries like Germany and Switzerland, which use hand-counted paper ballots, exit polls are accurate to a margin error of less than 1%.Here the 2016 exit polls were paid for by a major corporate media consortium, as has been standard practice for years. Here they are designed to reflect the actual vote count within a 2% margin of error nationally.But in the US, if exit polls don't agree with official vote counts, they are regularly ""adjusted"" to conform to official results, no matter how implausible. This makes fraudulent elections appear legitimate.During this year's Republican primaries, unadjusted exit polls confirmed official vote counts in all cases. In the Democratic primaries, unadjusted exit polls significantly varied from the official outcome in 12 of 26 primaries. All the errors went in Hillary Clinton's favor in her race against Bernie Sanders. This is a virtual statistical impossibility and suggests a rigged vote count.In the general election against Donald Trump, things went the other way. In 24 of 28 states, unadjusted exit polls also showed Clinton with vote counts significantly higher than the final official outcome. The likelihood of this happening in an election that is not rigged are in the realm of virtual statistical impossibility. In fact, based on the exit polls, the odds against such an unexplained ""Trump Shift"" are one in 13,110 presidential elections.For example, Ohio's exit polls showed Trump and Clinton in a dead heat â€“ 47 percent for Clinton to 47.1 for Trump. Officially, Trump won with 52.1 percent of the vote to Clinton's 43.5 percent. This unexplained and unexpected 8.5 percent shift for Trump is mathematically impossible. (see chart below)Given the prevalence of other Jim Crow tactics, it's likely the exit polls were impacted by non-white voters in all the key swing states who were given provisional ballots (or they voted electronically) leading them to believe their votes were being counted, even though they were not.In key Senate races in Florida, Pennsylvania, Wisconsin and Missouri, exit polls also showed Democratic candidates winning by statistically significant margins, but then losing the official vote count. In 2014, Senate races in North Carolina, Colorado and Alaska ended with exit polls also showing Democratic Senate candidates winning the popular vote, while ultimately losing the official vote count. The odds against this happening in two consecutive elections that are not rigged are also astronomical. (see chart below)Electronic FlippingThe vast majority of the popular votes in this election nationwide were cast on either computerized touch-screen electronic machines, or on scantron ballots that are counted by computer. In neither case are there public monitoring capabilities or legal recourse for vote counts that are flipped. In 2016, as in all previous US elections at least since 2000, the electronic vote count remains anyone's guess. In states with a governor and Secretary of State from the same party, the final tally can be whatever they want it to be. Such techniques were used in Florida 2000 and Ohio 2004 to strip voter rolls and flip George W. Bush into the White House. More than 90,000 black/Hispanic voters were disenfranchised by Gov. Jeb Bush (George's brother) in a Florida election officially decided by 537 votes. More than 300,000 primarily black/Hispanic voters were stripped from voter rolls in an Ohio 2004 election officially decided by 118,775.In Florida's 2000 presidential election, in Volusia County 16,000 votes cast for Gore were electronically subtracted and 4,000 were added to Bush, giving him a leg up on the evening's vote count. This caused a Fox News commentator John Ellis (who was Bush's first cousin) to call the election for George W. Bush. In Ohio 2004, John Kerry was shown winning the election by 4.2%, more than 200,000 votes, at 12:20am. Then the electronic vote count ceased. At 2 a.m. a Bush lead began to emerge, somehow reaching 2.5%. The 6.7% flip is a virtual statistical impossibility. All of this was done by private contractors working for the company SmarTech, based in Chattanooga, Tennessee. The key information technology specialist in charge of the vote count was Michael Connell, an Akron-based associate of the Bush family, who was hired by the Ohio Secretary of state with a no-bid contract to supervise the state's official vote count. Connell later died in a mysterious plane crash after being deposed in federal court.The fact that electronic voting machines cannot be monitored was voted a Most Censored story in 2016 with a key interview appearing on Amy Goodman's DEMOCRACY NOW.Computer ""Black Box Voting"" specialist Bev Harris, who uncovered the electronic vote flipping in Florida 2000, has warned this year that a method of ""fractionated voting"" could have been easily used to manipulate electronic vote counts. The manipulation could be done by Secretaries of State in conjunction with partisan for-profit corporations in ways that are virtually impossible to detect, and simply not open to legal challenge. According to Harris, this ""fraction magic,"" used in county central tabulators, could have flipped hundreds of thousands of votes.In Ohio this year, a new generation of electronic vote scanning machines makes it possible to retrieve electronic images of ballots that have been cast on paper in the order that they were cast. These machines come with an audit log that would detect any illegitimate vote changes by central tabulators. But Secretary of State Husted opted to allow local election boards to leave both security functionsâ€”-the audit log and the image scannersâ€”turned off. Co-author Bob Fitrakis sued in the Franklin County Court of Common Pleas, to have the monitoring functions turned on. But Judge David Cain ruled on Election Day that the election officials need not turn on those security features.Throughout the US, including the swing states that will decide the presidential outcome in the Electoral College, and in those that have increased the GOP margin in the US Senate, the entire vote count remains an electronic mystery. Millions of dollars would be required to do meaningful recounts in states like Wisconsin, which may well have legitimately gone for Clinton and chosen a Democratic US Senator. Huge sums of money would be required to fund independent investigators to confirm who actually won these public offices as cast, recordedâ€”and possibly manipulatedâ€”on these electronic machines.So did the GOP strip and flip the 2016 election?Let's count the ways:There is no doubt that Hillary Clinton won America's popular vote by more than a million votes.That popular vote victory will be reversed in an Electoral College originally designed to enhance the power of slaveowners, now being used for the sixth time to deny the White House to the rightful winner.There is no doubt that more than enough black, Hispanic, Islamic and Asian-Americans were electronically stripped from the voter registration rolls by Crosscheck and other means to have given Clinton victories in those swing states that would have swung the Electoral College in her favor.There is no doubt additional Jim Crow tactics meant to further disenfranchise black/Hispanic/Asian-Americanâ€”such as stripping away voting times and precincts, denial of absentee ballots, non-counting of provisional ballots and much moreâ€”stripped Clinton of hundreds of thousands of additional legitimate votes.  There is no doubt exit polls showed her winning in more than enough states to have given her a victory in the Electoral College.There is no doubt that the election was largely conducted on electronic machines, and with electronically counted scantron ballots, that are completely beyond public accountability. These voting machines are run on secret corporate proprietary software to which the public is not allowed access.As in 2000 and 2004, the actual final vote count once again resides in black box machines controlled by GOP governors and Secretaries of State whose easy ability to hack and flip the official outcome cannot be monitored or brought to accountability. In at least one state (Ohio) the GOP took legal action to prevent the public from gaining potential access to the electronic vote countâ€_.and won!There is also no doubt that had this election been conducted as it was in virtually any other country, the civilized world would have denounced it as completely unreliable and almost certainly false. Had it been in our ""national interest"" to do so, American troops would have poured in to ""restore democracy"" after such an obviously rigged charade.Throughout the campaign GOP candidate Trump cleverly complained of a ""rigged election."" He continually warned of innumerable non-whites and Muslims voting multiple times for Hillary Clinton.Of course the opposite happened. Hundreds of thousands of non-white citizens were systematically denied their right to vote. Since even that wasn't enough to elect Donald Trump, the Electoral College will once again deny democracy. And thanks to the dark magic of electronic voting machines, we will never really know 2016's true vote count.Today's most tangible tragedy is what may soon unfold in this country.But the underlying nightmare is that this has been done before. That we've known about stripped and flipped elections for at least sixteen years. And that nothing has been done.If anything, due to the spread of electronic voting machines, our electoral system is more corrupt and less accountable than it was in 2000, when the GOP first stripped and flipped George W. Bush into the White House.We advocate universal automatic voter registration, transparent voter rolls, a four-day national holiday for voting, universal hand-counted paper ballots, abolition of the Electoral College, an end to gerrymandering, a ban on corporate money in politics.There's much more. But until we win those basics, democracy in America is an illusionâ€_.as is our chance to survive on this planet.""",Did the GOP Strip and Flip the 2016 Selection?,link,http://columbusfreepress.com/article/did-gop-strip-flip-2016-selection,11/28/16 17:00,1178,914,541,850,26,72,46,16,168,2016-11-28
240944029279128_1380636161976570,Voters in more than 100 precincts have filed affidavits to kickstart a recount in Pennsylvania. We still need more voters in each precinct to initiate a recount. Get started: jill2016.com/recountPA,"As Grassroots Demand for Historic Recounts Grows, Jill Stein Files for Election Recount in PA",link,http://www.jill2016.com/pa_announcement,11/28/16 14:17,2978,944,736,2439,318,14,35,1,171,2016-11-28
240944029279128_1379242368782616,"Please join the conversation as I chat with Robin Laverne Wilson about her time at Standing Rock this week, her Green Party candidacy against Chuck Schumer (US Senator of the 1% in NY), and her ongoing work in education, theater and activism!",Robin Laverne Wilson and Jill Stein,video,https://www.facebook.com/drjillstein/videos/1379242368782616/,11/27/16 17:02,2383,4063,708,1494,592,11,39,14,233,2016-11-27
240944029279128_1379010602139126,PA Recount 101: I'm live to discuss with you how the voter-initiated Pennsylvania recount will work and why it's different from the process in other states. I need your help on the ground to make this happen! Jill2016.com/recountPA,,video,https://www.facebook.com/drjillstein/videos/1379010602139126/,11/27/16 13:23,24829,31497,6683,14092,4123,128,577,145,5764,2016-11-27
240944029279128_1369381649768688,"The Green Platform presents an eco-social analysis and vision for our country. In contrast to the major political parties that create their platforms through back-room deals by insiders and power brokers, we have created a grassroots process that invites submissions from every local Green Party and every Green individual. To discover more about the Green platform visit: http://www.gp.org/platform",Want To Learn More About The Green Party Platform?,link,http://www.gp.org/platform,11/27/16 12:00,1171,559,277,956,108,0,41,2,64,2016-11-27
240944029279128_1378136585559861,"Welcome to my weekly Fireside Chat! This week, I am live to discuss how we organize ourselves for a more transparent democracy. I will also answer your questions about the recount campaign.",,video,https://www.facebook.com/drjillstein/videos/1378136585559861/,11/26/16 21:22,5158,9481,1638,2845,1329,19,99,30,836,2016-11-26
240944029279128_1377834762256710,"Since yesterday, I've answered even more frequently asked questions about #Recount2016 on this webpage. Still curious about the recount process? List your questions in the comments and I'll answer them soon!",#Recount2016: Frequently Asked Questions,link,http://jill2016.com/recountfaq,11/26/16 17:13,2486,1911,544,1850,227,7,36,4,362,2016-11-26
240944029279128_1369399743100212,Democracy is more than just casting a vote. Organizing and voicing your opinion are part of it.,Why Anti-Trump Protests Matter,link,http://www.rollingstone.com/culture/why-anti-trump-protests-matter-w450561,11/26/16 15:00,4652,1310,607,3914,373,12,34,4,315,2016-11-26
240944029279128_1369372896436230,"Tune in at 9 p.m. ET for my weekly Fireside Chat livestream, right here on my Facebook page. Tonight's livestream will focus on organizing! Send me your pressing questions so I can be sure to address those tonight!",Timeline Photos,photo,https://www.facebook.com/drjillstein/photos/a.267467419960122.70392.240944029279128/1369372896436230/?type=3,11/26/16 12:00,2150,650,381,1763,250,3,14,0,120,2016-11-26
240944029279128_1376595249047328,"I am joined tonight with Kevin Ronca, the director and creator of the incredible docuseries, ""The Revolution Televised."" Although only 13 minutes in length, each of these episodes get to the heart of the matter: exposing the corruption that has been taking place in our sick political system! I would like to invite you to join the conversation as we will be releasing the 4th episode in this series right now, followed by a live Q&A session between our viewers, me and Kevin about this extraordinary series and where he goes from here. I'm sure you all have heard about the dramatic developments at Standing Rock, including the announcement today by the Army Corps of Engineers (see below). Kevin is willing to go there with his team to bear witness to this very important struggle. --- Press Release from Army Corps of Engineers 11/25/16: https://www.facebook.com/IndigenousLifeMovement/photos/pcb.10153645437442255/10153645437392255/?type=3&theater--Here are some of the answers to the questions asked during ""A Voice From The Margins: Intersectional Discussions on Empire and Resistance"" with Ajamu Baraka and Dawn Neptune Adams on yesterday's livestream on Standing Rock.-Question 1: Is there a resource for people to find rideshares to Standing Rock and share other resources to strengthen solidarity there?Answer: For people in the Northeast - https://www.facebook.com/groups/NEtoStandingRock/Do a local search to find similar groups near you.-Question 2: If we have useful gear to donate, what can we do to get it to Standing Rock resistors?Answer: Find local groups who are traveling to Standing Rock and ask to send it with them. Things can also be mailed. Here are some addresses - Learn more about our camp at www.ocetisakowincamp.orgDirect Donations: http://www.paypal.me/ocetisakowincampSee list of needed items: http://www.ocetisakowincamp.org/donateSend Donations to: Oceti Sakowin CampP.O. Box 298Cannonball, ND 58528The Standing Rock Medic and Healer Council has a list of supplies needed found here:https://medichealercouncil.com/donate/Donated items can be sent to:Standing Rock Medic & Healer Council, PO Box 1251, Bismarck, ND, 58502 â€“ or if you are shipping via UPS or FedEx, please use the address 220 E Rosser Ave #1251, Bismarck ND 58502. Use the number 701-409-0199 as shipping phone if needed.Red Warrior Camp and Sacred Stone Camp - https://nodaplsolidarity.org/(frontline and Indigenous-led resistance through non-violent direct action)-Question 3: What items are most needed in the camps?Answer: The camps have lists of requested items on their websites and often share Amazon wish-lists on Facebook.  Winter survival gear is most needed right now, but sending a monetary donation ensures that the camp is able to buy what they need.  This includes hard-to-send items like building supplies and tools for building winter shelters.-Question 4: Can we link the current effort to get banks to withdraw from DAPL to a more systemic critique of capitalism? We need to democratize finance.Answer:  Yes! Decolonize and localize finance. Make sure that Academic institutions and local groups divest, too.#NoBlackSnakeFriday#DefundDAPLhttps://www.prod.facebook.com/DeFundDAPL/http://www.defunddapl.org/Full list of banks funding DAPL: http://bit.ly/2fNurcm-Question 5: What are the most reliable news sources for continuing developments at Standing Rock? Who is doing the best reporting?Answer: I follow frontline Water Protectors/citizen journalists on Facebook and I've enabled notifications for when they go Live. You can also edit your settings on Facebook to ""See First"", so that when you sign on to your account, you'll see the pages you want to see, right away.Suggestions -Waniya Locke https://www.facebook.com/waniyal?fref=tsDigital Smoke Signals https://www.facebook.com/DigitalSmokeSignals/?fref=tsMarshall Lee https://www.facebook.com/marshall.hannigan?fref=tsWest Coast Women Warriors Media Cooperative https://www.facebook.com/Westcoastwomenwarriors/Indigenous Rising Media https://www.facebook.com/Indigenousrisingmedia/?pnref=storyCensored News from Brenda Norrell is a trusted source -(A lot of Indigenous people send their pictures and videos to her to be published) https://www.facebook.com/Censored-News-428451600511125/?ref=page_internal-Question 6: How should we parse claims that elected officials like Barack Obama have no control over these private corporations and supposedly private land?Answer: First, this is not private land, nor Army Corps of Engineer's land. It's ALL Indian land, but the land in question is Treaty land. Abrogations of the Ft. Laramie treaties of 1851 and 1868 reduced the lands of the Great Sioux Nations in the last hundred+ years. However, the land surrounding and under Lake Oahe was stolen somewhat recently; in the 1960s.Here's some historical background:http://www.msnbc.com/interactives/geography-of-poverty/nw.htmlWhen I posted this link last week, one of the shero Warrior grandmas I admire, (Debra White Plume) said:""a lot of factual history in this article, please read and share. while it hovers around poverty porn, please remember that we are a resilient people and we do not measure our wealth by the material gains accumulated. we are firstly a spiritual people, and then we are warriors. warriors with a heart full of love and prayer, the strongest weapons of all. come stand with us at the river. come now.""Second, Obama made promises that he should be held to. He must find a way to use his Executive power to put a stop to this; or risk ending his Presidency in disgrace by further capitulating to industry and the corporate-ocracy, against the wishes of a majority of the American People.Obama, Honor the Treaties and honor your words. The whole world is watching.Here is a video by Juice Rap Media.https://www.youtube.com/watch?v=cYqH1FrG_Yg",Jill Stein and the Revolution Televised,video,https://www.facebook.com/drjillstein/videos/1376595249047328/,11/25/16 21:12,1708,3768,668,1012,396,10,25,13,252,2016-11-25
240944029279128_1376512802388906,"I'm  pleased to announce that thanks to over 100,000 small-dollar donors, we filed our recount petition in Wisconsin today!MADISON, WI - At 3:09pm Central Time, attorneys on behalf of Jill Stein electronically filed a recount petition to request a recount of the 2016 presidential election vote in Wisconsin, as part of a bid to demand recounts in the three states of Wisconsin, Michigan, and Pennsylvania. Receipt of the filing from the Wisconsin Elections Commission was confirmed at 3:45pm.The filing fee for the recount request in Wisconsin is estimated to be approximately $1.1 million. After opening a fundraising drive on Wednesday, the campaign raised the needed funds for Wisconsin within a matter of hours. So far, over $5 million has been raised from over 110,000 donors with an average of $45 each. Total costs are expected to be approximately $7 million dollars.""We are standing up for an election system that we can trust; for voting systems that respect and encourage our vote, and make it possible for all of us to exercise our constitutional right to vote,"" said Jill Stein, former Green Party presidential candidate. ""We demand voting systems that are accurate, secure and accountable to the people. This is part of a larger commitment to election reform that our campaign and the Green Party has long stood for, which includes open debates, an end to voter ID laws and voter suppression, and ranked choice voting,"" Stein added.""The recount was not filed in order to change the election outcome, which is unlikely, nor to favor any one candidate. We are pursuing this recount to verify the integrity of the election result,"" said David Cobb, Stein/Baraka campaign manager. As the Green Party presidential candidate in 2004, Cobb led a recount effort in Ohio which led to election reforms in other states, including the banning of DRE touchscreen voting machines in California and a revamped voting system in New Mexico. The recount also helped to launch a nationwide movement for election integrity.The three states were recommended for scrutiny by election integrity experts and advocates because of the vulnerability of their voting systems and various indicators of concern - including unexplained high numbers of undervotes, the close results between the two candidates, and observed discrepancies between pre-election polling and the official result. Without meaningful machine audit procedures, a paper recount is the only sure way to verify an election result.The recount petition will be transmitted to the county canvassing boards in Wisconsin along with a formal request for an estimate of recount costs and a decision on recount methodology. The recount could begin by the second half of next week.The Stein/Baraka campaign is looking for volunteers to observe the recount in every county. To volunteer, interested individuals can contact the campaign at http://jill2016.com/RecountWI.",,video,https://www.facebook.com/drjillstein/videos/1376512802388906/,11/25/16 20:20,30887,27889,6654,19584,5303,197,672,147,4984,2016-11-25
240944029279128_1376327742407412,"BREAKING: We've filed in Wisconsin! #Recount2016 will begin next week. If you live in Wisconsin, or know of anyone who does, please ask them to consider volunteering to help in the recount process: jill2016.com/RecountWI",Timeline Photos,photo,https://www.facebook.com/drjillstein/photos/a.267467419960122.70392.240944029279128/1376327742407412/?type=3,11/25/16 17:01,27243,18965,7567,19776,3636,211,479,52,3089,2016-11-25
240944029279128_1369398683100318,Be the change.,Help Build a Green Future,link,http://www.jill2016.com/GreenFuture,11/25/16 15:00,891,581,91,677,92,2,13,1,106,2016-11-25
240944029279128_1369370749769778,"Are you a graphic designer, videographer, or creative activist? We would love to showcase your work. http://www.jill2016.com/Create",Join The Stein/Baraka Social Media Team! Here's How...,link,http://www.jill2016.com/Create,11/25/16 12:00,647,409,98,511,57,3,7,0,69,2016-11-25
240944029279128_1375368425836677,"Another people-powered win! Congratulations on meeting the recount costs for both Wisconsin and Pennsylvania! We are now focusing on raising the needed funds for Michigan's recount (due Wednesday). If you live in Pennsylvania, or know of anyone who does, we are looking for election integrity volunteers.Help us take a stand: Jill2016.com/RecountPA",We Deserve Elections We Can Trust!,link,http://www.jill2016.com/recountpa,11/24/16 23:18,14583,2733,3427,12279,1636,291,91,8,278,2016-11-24
240944029279128_1375272879179565,"""A Voice From The Margins: Intersectional Discussions on Empire and Resistance"" with Ajamu Baraka and Dawn Neptune Adams.--Here are some of the answers to the questions asked during this livestream:Question 1: Is there a resource for people to find rideshares to Standing Rock and share other resources to strengthen solidarity there?Answer: For people in the Northeast - https://www.facebook.com/groups/NEtoStandingRock/Do a local search to find similar groups near you.-Question 2: If we have useful gear to donate, what can we do to get it to Standing Rock resistors?Answer: Find local groups who are traveling to Standing Rock and ask to send it with them. Things can also be mailed. Here are some addresses - Learn more about our camp at www.ocetisakowincamp.orgDirect Donations: http://www.paypal.me/ocetisakowincampSee list of needed items: http://www.ocetisakowincamp.org/donateSend Donations to:  Oceti Sakowin Camp P.O. Box 298Cannonball, ND 58528The Standing Rock Medic and Healer Council has a list of supplies needed found here:https://medichealercouncil.com/donate/Donated items can be sent to:Standing Rock Medic & Healer Council, PO Box 1251, Bismarck, ND, 58502 â€“ or if you are shipping via UPS or FedEx, please use the address 220 E Rosser Ave #1251, Bismarck ND 58502. Use the number 701-409-0199 as shipping phone if needed.Red Warrior Camp and Sacred Stone Camp - https://nodaplsolidarity.org/(frontline and Indigenous-led resistance through non-violent direct action) -Question 3: What items are most needed in the camps?Answer: The camps have lists of requested items on their websites and often share Amazon wish-lists on Facebook.  Winter survival gear is most needed right now, but sending a monetary donation ensures that the camp is able to buy what they need.  This includes hard-to-send items like building supplies and tools for building winter shelters.-Question 4: Can we link the current effort to get banks to withdraw from DAPL to a more systemic critique of capitalism? We need to democratize finance.Answer:  Yes! Decolonize and localize finance. Make sure that Academic institutions and local groups divest, too.#NoBlackSnakeFriday#DefundDAPLhttps://www.prod.facebook.com/DeFundDAPL/http://www.defunddapl.org/Full list of banks funding DAPL: http://bit.ly/2fNurcm-Question 5: What are the most reliable news sources for continuing developments at Standing Rock? Who is doing the best reporting?Answer: I follow frontline Water Protectors/citizen journalists on Facebook and I've enabled notifications for when they go Live. You can also edit your settings on Facebook to ""See First"", so that when you sign on to your account, you'll see the pages you want to see, right away.Suggestions -Waniya Locke https://www.facebook.com/waniyal?fref=tsDigital Smoke Signals https://www.facebook.com/DigitalSmokeSignals/?fref=tsMarshall Lee https://www.facebook.com/marshall.hannigan?fref=tsWest Coast Women Warriors Media Cooperative https://www.facebook.com/Westcoastwomenwarriors/Indigenous Rising Media https://www.facebook.com/Indigenousrisingmedia/?pnref=storyCensored News from Brenda Norrell is a trusted source - (A lot of Indigenous people send their pictures and videos to her to be published)  https://www.facebook.com/Censored-News-428451600511125/?ref=page_internal-Question 6: How should we parse claims that elected officials like Barack Obama have no control over these private corporations and supposedly private land?Answer: First, this is not private land, nor Army Corps of Engineer's land. It's ALL Indian land, but the land in question is Treaty land. Abrogations of the Ft. Laramie treaties of 1851 and 1868 reduced the lands of the Great Sioux Nations in the last hundred+ years. However, the land surrounding and under Lake Oahe was stolen somewhat recently; in the 1960s. Here's some historical background:http://www.msnbc.com/interactives/geography-of-poverty/nw.htmlWhen I posted this link last week, one of the shero Warrior grandmas I admire, (Debra White Plume) said:""a lot of factual history in this article, please read and share. while it hovers around poverty porn, please remember that we are a resilient people and we do not measure our wealth by the material gains accumulated. we are firstly a spiritual people, and then we are warriors. warriors with a heart full of love and prayer, the strongest weapons of all. come stand with us at the river. come now.""Second, Obama made promises that he should be held to. He must find a way to use his Executive power to put a stop to this; or risk ending his Presidency in disgrace by further capitulating to industry and the corporate-ocracy, against the wishes of a majority of the American People.Obama, Honor the Treaties and honor your words. The whole world is watching.Here is a video by Juice Rap Media. https://www.youtube.com/watch?v=cYqH1FrG_Yg",Ajamu Baraka and Dawn Neptune Adams,video,https://www.facebook.com/drjillstein/videos/1375272879179565/,11/24/16 21:01,1053,833,584,733,245,2,10,16,47,2016-11-24
240944029279128_1369400469766806,,Timeline Photos,photo,https://www.facebook.com/drjillstein/photos/a.267467419960122.70392.240944029279128/1369400469766806/?type=3,11/24/16 19:00,5624,538,963,5056,448,8,19,2,91,2016-11-24
240944029279128_1374933035880216,Jill Stein here to answer some of your pressing questions about election integrity and why it's so important for us to address this now.,,video,https://www.facebook.com/drjillstein/videos/1374933035880216/,11/24/16 15:38,12984,24843,2424,4682,1961,76,440,132,5693,2016-11-24
240944029279128_1369394589767394,"Yes! Cannot wait for tonight's livestream conversation with Ajamu Baraka, and Dawn Neptune. Tune in right here on this Facebook page.",Timeline Photos,photo,https://www.facebook.com/drjillstein/photos/a.267467419960122.70392.240944029279128/1369394589767394/?type=3,11/24/16 15:00,485,214,115,406,45,2,11,0,21,2016-11-24
240944029279128_1369367503103436,Want more local Green news?,Follow To Find Out About Green Party State & Local News,link,http://www.gp.org/state_local_news,11/24/16 12:00,628,189,83,549,40,1,5,1,32,2016-11-24
240944029279128_1374039015969618,"A people-powered win! Congratulations on meeting the recount costs for Wisconsin. Raising money to pay for the first round so quickly is a miraculous feat and a tribute to the power of grassroots organizing.Now that we have completed funding Wisconsin's recount (which is due on Friday), we can begin to tackle the funding for Michigan's recount (due Monday) and Pennsylvania's recount (due Wednesday).If you live in Wisconsin, or know of anyone who does, we are looking for election integrity volunteers. Help us take a stand: http://www.jill2016.com/RecountWI",We Deserve Elections We Can Trust!,link,http://www.jill2016.com/RecountWI,11/24/16 11:00,12390,1624,2669,10475,1472,88,61,9,285,2016-11-24
240944029279128_1373890735984446,"The Stein/Baraka Green Party Campaign is launching an effort to ensure the integrity of our elections. We are raising money to demand recounts in Wisconsin, Michigan, and Pennsylvania -- three states where the data suggests significant discrepancies in vote totals. Please donate to this initiative today: jill2016.com/2016Recounts",2016 Election Integrity,link,http://www.jill2016.com/2016recounts,11/23/16 22:30,7026,1223,2484,5993,751,100,76,2,104,2016-11-23
240944029279128_1373826725990847,"Tonight, I'm chatting live with Bob Fitrakis, an elections integrity attorney, about why the Stein/Baraka campaign is going to demand recounts in Michigan, Pennsylvania and Wisconsin. Bob called the first public hearings on voter suppression and presidential election irregularities in 2004, and he was one of four attorneys to file a challenge to Ohio's 2004 presidential election results.The recounts will cost our campaign $2.5 million. Please consider contributing to help restore election integrity: jill2016.com/recount",Jill Stein and Bob Fitrakis,video,https://www.facebook.com/drjillstein/videos/1373826725990847/,11/23/16 21:02,3844,3842,1994,2963,650,56,37,8,130,2016-11-23
240944029279128_1373593929347460,"Campaign Manager David Cobb announces Recount efforts in WI, PA and MI",,video,https://www.facebook.com/drjillstein/videos/1373593929347460/,11/23/16 15:04,6918,2889,2884,5399,1171,169,58,14,107,2016-11-23
240944029279128_1369392156434304,"""In May 1984, when progressive politics in the United States was fighting for survival, a Green Movement Committee was founded with the goal of ""the formation of a Green political organization in the USA."" The committee declared, ""To be effective, a Green political organization must originate from a broad base of support, from natural allies concerned with ecological politics and social justice, peace and non-violence, local and regional self-management and grassroots democracy."" That summer, the founding meeting of U.S. Greens took place in St. Paul, Minnesota.""Find out more: http://www.gp.org/history",Do You Know About The Green Party History?,link,http://www.gp.org/history,11/23/16 15:00,671,120,166,587,62,2,1,0,19,2016-11-23
240944029279128_1373413919365461,"Our press director, Meleiza 'Mel' Figueroa, is coming to you live to give a heads up for a very important announcement we will be making later today regarding the fight for election integrity. Stay tuned and watch this space!",,video,https://www.facebook.com/drjillstein/videos/1373413919365461/,11/23/16 12:31,991,382,339,758,193,7,8,1,24,2016-11-23
240944029279128_1369362889770564,"Join me tonight, at 9PM ET, for my special livestream series. If you have specific questions you'd like answered, be sure to leave those in the comments below.",Timeline Photos,photo,https://www.facebook.com/drjillstein/photos/a.267467419960122.70392.240944029279128/1369362889770564/?type=3,11/23/16 12:00,4712,185,1129,4172,514,8,2,1,15,2016-11-23
240944029279128_1369387136434806,"A beautiful essay written by Cat Brooks, a local Oakland activist, about the critical next steps in movement building. ""It means identifying what social services are going to be cut under a Republican presidency and Congress, and creating alternative means of getting food, shelter, and medical treatment to the people.It means opening our own schools.It means developing real alternatives to calling police and stemming the tide of our people being funneled into American concentration camps.It means divesting from the state that never has, and never will, have our backs, and investing in training, campaigns, and pathways that empower the people to depend on themselves and each other. This is not an overnight solution. There are no quick fixes to the plague of repression that infects this country. This is long, arduous and incremental work.But we have to start somewhere. We have to begin in earnest to move from rhetoric to action.This is not the time for despair. This is not the time for fear.This is the time to train, study and organize.""",Oakland Activist Cat Brooks on President Trump: 'My Revolutionary Prayer',link,http://www.eastbayexpress.com/oakland/oakland-activist-cat-brooks-on-president-trump-my-revolutionary-prayer/Content?oid=5034539,11/22/16 15:00,743,87,257,619,103,4,2,6,9,2016-11-22
240944029279128_1371985186175001,"Are you familiar with the local Greens in your area? We have at least 138 Greens in 17 states as of the November 2016 elections.http://www.gp.org/officeholders",Check Out The Green Party Officeholders In Your Area,link,http://www.gp.org/officeholders,11/22/16 12:00,1135,75,229,1022,95,9,1,2,6,2016-11-22
240944029279128_1371252246248295,"Please join the conversation between David Cobb, 2016 Stein/Baraka Campaign manager, and Evan Duke, front line activist at Standing Rock and Co-convenor of Occupy Inauguration--We urge all people of conscience to take urgent action by speaking out, donating, and supporting the camp, as suggested by the water protectors:- The most effective means of showing support for this cause is to actively participate in protecting this sacred land. Anyone who is able to travel to the peaceful encampments is encouraged to do so.- Donate to the camp medic & healer council: https://medichealercouncil.com/donate/ - Donate medical supplies by ordering online through their list - the link is listed in this post: https://amzn.com/w/284OV04OWXQG9 - Donate to the Oceti Sakowin camp and help them thru the winter: http://www.ocetisakowincamp.org/donate - Call North Dakota governor Jack Dalrymple at 701-328-2200 and give him a piece of your mind- Call the Morton County Sherriff's department at 701-328-8118 & 701-667-3330 and the North Dakota National Guard at 701-333-2000 and tell them to stand down- Call the White House at (202) 456-1111 or (202) 456-1414. Tell President Obama to rescind the Army Corps of Engineers' Permit for the Dakota Access Pipeline.- Call the executives of the companies that are building the pipeline: Lee Hanse Executive Vice President Energy Transfer Partners, L.P. (210) 403-6455 ; Glenn Emery Vice President Energy Transfer Partners, L.P. (210) 403-6762 ; Michael (Cliff) Waters Lead Analyst Energy Transfer Partners, L.P. (713) 989-2404 - Call the Army Corps of Engineers and demand that they reverse the permit: (202) 761-5903- Contact The 17 Banks Funding The Pipeline, and withdraw your money: http://www.commondreams.org/views/2016/10/28/how-contact-17-banks-funding-dakota-access-pipeline",David Cobb and Evan Duke,video,https://www.facebook.com/drjillstein/videos/1371252246248295/,11/21/16 21:04,1081,992,855,728,251,7,3,31,61,2016-11-21
240944029279128_1371206352919551,"Call to action to stand with Standing Rock!We deplore the brutal attack against the Standing Rock water protectors that began Sunday night, as the water protectors attempted to clear disabled vehicles blocking a bridge leading to their encampment. Over 160 water protectors have been injured from a vicious assault by DAPL security using water cannons in subfreezing weather, rubber bullets, concussion grenades, sound cannon, tear gas and mace. It is appalling that even before Donald Trump takes office, this violent repression is already ongoing. Indigenous people were the first group to be brutalized and oppressed when the first European settlers came to American shores. Now they are at the frontlines of an increasingly protofascist nation.  Standing Rock is a microcosm of the crisis we face, where the violation of human rights, water, land, climate and democracy are converging.President Obama stated he wanted to stand back and see what happens. Now he has seen what happens. It's time for the Army Corp of Engineers to definitively deny the permit the Dakota Access Pipeline needs to drill beneath the Missouri River. It's time to stop this assault on humanity and Mother Earth for once and for all.Ajamu Baraka and I will be visiting Standing Rock in early December to face the charges filed against us for peaceful civil disobedience in support of the water protectors. We will also be there to support the ongoing struggle. Ajamu and I invite President Obama to join us, and to see for himself what this struggle for land, water, indigenous rights, human rights, mother earth and democracy looks like. This is the time for all of us, including the President of the United States, to do the right thing - no matter how you voted, no matter what party you might or might not identify with. The fate of all of us is on the line right now. We urge all people of conscience to take urgent action by speaking out, donating, and supporting the camp, as suggested by the water protectors:- Donate to the camp medic & healer council: https://medichealercouncil.com/donate/  - Donate medical supplies by ordering online through their list - the link is listed in this post: https://amzn.com/w/284OV04OWXQG9 - Donate to the Oceti Sakowin camp and help them thru the winter: http://www.ocetisakowincamp.org/donate - Call North Dakota governor Jack Dalrymple at 701-328-2200 and give him a piece of your mind- Call the Morton County Sherriff's department at 701-328-8118 & 701-667-3330 and the North Dakota National Guard at 701-333-2000 and tell them to stand down- Call the White House at (202) 456-1111 or (202) 456-1414. Tell President Obama to rescind the Army Corps of Engineers' Permit for the Dakota Access Pipeline.- Call the executives of the companies that are building the pipeline: Lee Hanse Executive Vice President Energy Transfer Partners, L.P. (210) 403-6455 ; Glenn Emery Vice President Energy Transfer Partners, L.P. (210) 403-6762 ; Michael (Cliff) Waters Lead Analyst Energy Transfer Partners, L.P. (713) 989-2404 - Call the Army Corps of Engineers and demand that they reverse the permit: (202) 761-5903- Contact The 17 Banks Funding The Pipeline, and withdraw your money: http://www.commondreams.org/views/2016/10/28/how-contact-17-banks-funding-dakota-access-pipeline",,video,https://www.facebook.com/drjillstein/videos/1371206352919551/,11/21/16 19:41,17644,4969,18523,11535,4652,58,51,956,392,2016-11-21
240944029279128_1369385579768295,"""The neoliberal era in the United States ended with a neofascist bang. The political triumph of Donald Trump shattered the establishments in the Democratic and Republican parties â€“ both wedded to the rule of Big Money and to the reign of meretricious politicians.The Bush and Clinton dynasties were destroyed by the media-saturated lure of the pseudo-populist billionaire with narcissist sensibilities and ugly, fascist proclivities. The monumental election of Trump was a desperate and xenophobic cry of human hearts for a way out from under the devastation of a disintegrating neoliberal order â€“ a nostalgic return to an imaginary past of greatness.White working- and middle-class fellow citizens â€“ out of anger and anguish â€“ rejected the economic neglect of neoliberal policies and the self-righteous arrogance of elites. Yet these same citizens also supported a candidate who appeared to blame their social misery on minorities, and who alienated Mexican immigrants, Muslims, black people, Jews, gay people, women and China in the process.This lethal fusion of economic insecurity and cultural scapegoating brought neoliberalism to its knees. In short, the abysmal failure of the Democratic party to speak to the arrested mobility and escalating poverty of working people unleashed a hate-filled populism and protectionism that threaten to tear apart the fragile fiber of what is left of US democracy. And since the most explosive fault lines in present-day America are first and foremost racial, then gender, homophobic, ethnic and religious, we gird ourselves for a frightening future.What is to be done? First we must try to tell the truth and a condition of truth is to allow suffering to speak. For 40 years, neoliberals lived in a world of denial and indifference to the suffering of poor and working people and obsessed with the spectacle of success. Second we must bear witness to justice. We must ground our truth-telling in a willingness to suffer and sacrifice as we resist domination. Third we must remember courageous exemplars like Martin Luther King Jr, who provide moral and spiritual inspiration as we build multiracial alliances to combat poverty and xenophobia, Wall Street crimes and war crimes, global warming and police abuse â€“ and to protect precious rights and liberties.The age of Obama was the last gasp of neoliberalism. Despite some progressive words and symbolic gestures, Obama chose to ignore Wall Street crimes, reject bailouts for homeowners, oversee growing inequality and facilitate war crimes like US drones killing innocent civilians abroad.Rightwing attacks on Obama â€“ and Trump-inspired racist hatred of him â€“ have made it nearly impossible to hear the progressive critiques of Obama. The president has been reluctant to target black suffering â€“ be it in overcrowded prisons, decrepit schools or declining workplaces. Yet, despite that, we get celebrations of the neoliberal status quo couched in racial symbolism and personal legacy. Meanwhile, poor and working class citizens of all colors have continued to suffer in relative silence.In this sense, Trump's election was enabled by the neoliberal policies of the Clintons and Obama that overlooked the plight of our most vulnerable citizens. The progressive populism of Bernie Sanders nearly toppled the establishment of the Democratic party but Clinton and Obama came to the rescue to preserve the status quo. And I do believe Sanders would have beat Trump to avert this neofascist outcome!In this bleak moment, we must inspire each other driven by a democratic soulcraft of integrity, courage, empathy and a mature sense of history â€“ even as it seems our democracy is slipping away.We must not turn away from the forgotten people of US foreign policy â€“ such as Palestinians under Israeli occupation, Yemen's civilians killed by US-sponsored Saudi troops or Africans subject to expanding US military presence.As one whose great family and people survived and thrived through slavery, Jim Crow and lynching, Trump's neofascist rhetoric and predictable authoritarian reign is just another ugly moment that calls forth the best of who we are and what we can do.For us in these times, to even have hope is too abstract, too detached, too spectatorial. Instead we must be a hope, a participant and a force for good as we face this catastrophe.""https://www.theguardian.com/commentisfree/2016/nov/17/american-neoliberalism-cornel-west-2016-election","Goodbye, American neoliberalism. A new era is here | Cornel West",link,https://www.theguardian.com/commentisfree/2016/nov/17/american-neoliberalism-cornel-west-2016-election,11/21/16 16:00,2466,225,1130,2105,190,21,8,128,14,2016-11-21
240944029279128_1370804436293076,"A Call For Medical Supplies:""An updated list can be found on Standing Rock Medic & Healer Council and website, but are in desperate need of the following:Milk of Magnesia Wool socksWool blankets Space blankets Hand warmersTrauma kits (portable)Funding for advanced practitioner gearFunding for climate-controlled storage Straw balesAnd MOST of all...funding for winter structures. If you know someone that wants to donate a yurt for about $6000, it is a tax deduction! Please also check our Amazon list below!Standing Rock Medic & Healer CouncilAttn: Michael220 E Rosser, #1251Bismarck, ND 58502Funds for winterization: www.medichealercouncil.com/donateAmazon list: https://amzn.com/w/284OV04OWXQG9""Direct FB Link For Video: https://www.facebook.com/MedicHealerCouncil/videos/1035203733272116/For more action steps you can take, plus contact information, please reference the previous social media post.",Standing Rock Medic & Healer Council,video,https://www.facebook.com/MedicHealerCouncil/videos/1035203733272116/,11/21/16 14:00,2349,114,4,1854,168,10,1,304,12,2016-11-21
240944029279128_1369360219770831,"How to Contact the 17 Banks Funding the Dakota Access Pipeline. Here's the names of CEOs and other bank executives involved in these decisionsâ€”along with their phone numbers and email addresses. The first 17 banks (*) are directly funding the Dakota Access pipeline:Wells Fargo*CEO John StumpfJohn.G.Stumpf@wellsfargo.comBoardCommunications@wellsfargo.com866-249- 3302Corporate Office:Wells Fargo420 Montgomery StreetSan Francisco, CA 94104BNP Paribas*CEO Jean-Laurent Bonnafejean-laurent.bonnafe@bnpparibas.comCorporate Office:3 rue d'Antin75002 Paris, France00-33-157-082-200U.S. Office:787 Seventh Avenue - The Equitable TowerNew York, NY 10019212-841-3000SunTrust*CEO William H. Rodgers Jr.Corporate Office:303 Peachtree Street NEAtlanta, GA 30308800-786-8787Chief Communications Officer:Sue Mallino404-813-0463sue.mallino@suntrust.comThe Bank of Tokyo-Mitsubishi UFJ*Chairman Nobuyuki HiranoCEO and President Takashi OyamadaCorporate Office:2-7-1, Marunouchi, Chiyoda-kuTokyo, Japan81-3-3240-8111U.S. Office:1251 Avenue of the AmericasNew York, NY 10020-1104212-782-4000Mizuho Bank*President and CEO Nobuhide HayashiCorporate Office:Otemachi Tower1-5-5, Otemachi, Chiyoda-kuTokyo 100-8176, Japan81-3-3214-1111U.S. Office:1251 Avenue of the AmericasNew York, NY 10020212-282-3000Citibank (CitiGroup)*CEO Michael Corbatmichael.corbat@citi.com212-793-1201Corporate Office:388 Greenwich StreetNew York, NY 10013Phone: 800-285-3000 and 212-793-0710TD Securities*Chairman, CEO, and President Bob DorranceCorporate Office:P.O. Box 1, TD Bank Tower66 Wellington Street WToronto, OntarioM5K 1A2Investment Banking: 416-307-8500Equity Research: 416-307-9360Trading Floor Enquiries: 416-944-6978U.S. Office:31 West 52nd StreetNew York, NY 10019-6101212-827-7000Credit Agricole*CEO Jean-Paul ChiffletOffice:12, Place des Etats-UnisMontrouge, France 9254533-1-43-23-52-02U.S. Office:1301 Avenue of the Americas,New York, NY 10019infoamericas@ca-cib.comIntesa SanPaolo*CEO Carlo MessinaCorporate Office:Piazza San Carlo, 15610121 Torino, Italy39-011-555-1Corporate Social Responsibility Unit:39-02-8796-3435CSR@intesasanpaolo.comsostenibilita.ambientale@intesasanpaolo.comING Bank*CEO and Executive Board Chairman Ralph A.J.G HamerWholesale Banking, Operations & IT, Sustainability, Corporate Governance:Carolien van der Giessencarolien.van.der.giessen@ing.com31-20-576-63-86Head of Media Relations:Raymond Vermuelenraymond.vermeulen@ing.com31-20-576-63-69Corporate Office:Amsterdamse PoortBijlmerplein 8881102 MG AmsterdamThe Netherlands31-20-5639111Mailing Address:ING Bank N.V.P.O. Box 18001000 BV AmsterdamThe NetherlandsU.S. Office:ING Financial Holdings LLC1325 Avenue of the AmericasNew York, NY 10019646-424-6000Natixis*CEO Pierre ServantCorporate Office:Natixis Global Asset Management, S.A.21 quai d'Austerlitz75634 Paris Cedex 13, France33-1-78-40-90-00U.S. Office:Natixis Global Asset Management, L.P.399 Boylston StreetBoston, MA617-449-2100BayernLB*CEO Johannes-Jorg RieglerHead of Communications:Matthias PriwitzerMatthias.Priwitzer@bayernlb.de49-89-2171-21255Corporate Office:Brienner StraÃŸe 1880333 Munich49-89-2171-27176U.S. Office:560 Lexington AvenueNew York City, NY 10022212-310-9800BBVA Securities*CEO Carlos Torres VillaExecutive Chairman Francisco Gonzalez RodriguezCorporate Office:Calle Azul, 428050 Madrid, Spain34-902-22-44-66DNB First Bank*CEO and President William J. Hieb610-269-1040Main Branch:4 Brandywine AvenueDowningtown, PA 19335484-691-3621ICBC London*CEO and Managing Director Jin ChenCorporate Office:20 Gresham StreetLondon EC2V 7JE, United Kingdom44-203-145-5000U.S. Office:520 Madison Avenue 28th FloorNew York, NY 10022212-407-5000SMBC Nikko Securities*President and CEO Yoshihiko ShimizuCorporate Office:3-1, Marunouchi 3-chome, Chiyoda-kuTokyo 100-8325, Japan81-3-5644-3111Societe GeneralCEO Frederic Oudeahttps://www.linkedin.com/in/fredericoudeaChiarman of the Board Lorenzo Bini Smaghilorenzo.binismaghi@snam.itCorporate Office:29 boulevard Haussmann 75009Paris, France2.0@societegenerale33-1-42-14-20-00U.S. Office:245 Park AvenueNew York City, NY 10167212-278-6000The following banks are involved in funding for the entire Bakken pipeline:Royal Bank of ScotlandCEO Ross McEwanross.mcewan@rbs.co.ukDirector of Media Relations:Chris Turner44-20-7672-4515Corporate Office:Gogarburn175 Glasgow RoadEdinburgh, United Kingdom44-131-626-3263U.S. Office:600 Washington BoulevardStamford, CT 06901203-897-2700ABN Amro CapitalChairman of the Board Gerrit ZalmCorporate Office:ABN AMRO Bank N.V.Gustav Mahlerlaan 101082 PP AmsterdamThe Netherlands31-10-241-17-2U.S. Office:100 Park Avenue, 17th floorNew York, NY 10017917-284-6800Bank of Nova Scotia (Scotiabank)CEO and President Brian J. PorterCorporate Office:Scotia Plaza44 King Street WToronto, OntarioCanada M5H 1H1416-866-6161email@scotiabank.comU.S. Office:250 Vesey Street,23rd and 24th floorsNew York, NY 10281212-225-5000Scotia Howard Weil (""Energy Investment Boutique""):Energy Centre1100 Poydras Street Suite 3500New Orleans, LA 70163504-582-2500 and 800-322-3005howardweil@howardweil.comCitizens BankChairman and CEO Bruce Van SaunHead of Media Relations:Peter LuchtPeter.Lucht@citizensbank.com781-655-2289Consumer Lending, Business Banking, Wealth Management, Corporate:Lauren DiGeronimoLauren.Digeronimo@citizensbank.com781-471-1454Corporate Office:1 Citizens PlazaProvidence, RI 02903401-456-7000Comerica BankChairman and CEO Ralph W. Babb Jr.Investor Relations:214-462-6831Corporate Contacts:Wendy Bridgeswwbridges@comerica.com214-462-4443Wayne Mielkewjmielke@comerica.com214-462-4463Corporate Office:Comerica Bank Tower1717 Main StreetDallas, TX 75201800-521-1190U.S. BankChairman and CEO Richard K. Davisrichard.davis@usbank.comSenior Vice President of Corporate Communications Dana Ripleydana.ripley@usbank.com612-303-3167Brand, Corporate Social Responsibility, Sponsorships:Susan Beattysusan.beatty@usbank.com612-303-9229Corporate Office:U.S. Bancorp Center800 Nicollet MallMinneapolis, MN 55402800-685-5065 and 651-466-3000PNC BankChairman, President, and CEO William S. DemchakMedia Relations:Fred Solomoncorporate.communications@pnc.com412-762-4550Investor Relations:Bryan K. Gillinvestor.relations@pnc.com412-768-4143Corporate Office:300 Fifth AvenueThe Tower at PNC PlazaPittsburgh, PA 15222412-762-2000BarclaysChairman John McFarlanejohn.mcfarlane@barclays.comCEO Jes StaleyCorporate Office:Barclays Bank PLC1 Churchill PlaceLondon E14 5HP, United Kingdom44-20-7116-1000U.S. Office:Barclays745 7th AvenueNew York, NY 10019212-526-7000Press Office:212-526-7000CorporateCommunicationsAmericas@barclays.comJPMorgan ChaseChairman and CEO Jamie Dimonjamie.dimon@jpmchase.com212-270-1111Corporate Contacts:Andrew Grayandrew.s.gray@jpmchase.comJennifer Lavoiejennifer.h.lavoie@jpmchase.comBrian Marchionybrian.j.marchiony@jpmorgan.comCorporate Office:270 Park AvenueNew York, NY 10017-2014Bank of AmericaPresident, CEO, and Chairman Brian Moynihanbrian.t.moynihan@bankofamerica.comExecutive Relations, Office of the CEO:Matthew Task813-805-4873Corporate Office:100 N Tryon StreetCharlotte, NC 28255Deutsche BankCEO John CryanCorporate Contact:Renee Calabrorenee.calabro@db.com212-250-5525Corporate Address:Deutsche Bank AGTaunusanlage 1260325 Frankfurt Am Main (for letters and postcards: 60262)Germany49-69-910-00U.S. Office:Deutsche Bank AG60 Wall StreetNew York, NY 10005212-250-7171Compass BankChairman and CEO Manolo SanchezDirector of External Communications:Christina Andersonchristina.anderson@bbva.comCommunications:Al Ortizal.ortiz@bbva.com281-433-5640Corporate Office:15 S 20th StreetBirmingham, AL 35233205-297-1986Credit SuisseCEO Tidjane ThiamBoard Chairman Urs RohnerSuisse Banking Ombudsman:Bahnhofplatz 9P.O. Box 1818CH 8021 Zurich, Switzerland41-43-266-14-14Corporate Office:Uetlibergstrasse 231P.O. Box 700CH 8070 Zurich, Switzerland41-44-333-11-11U.S. Office:650 California StreetSan Francisco, CA 94108Phone: 415-249-2100DNB Capital/ASACEO Rune Bjerkehttps://www.linkedin.com/in/rune-bjerke-0471463Chairwoman of the Board Anne Carine Tanum47-915-04800Executive Vice President Communications Even Westerveld47-400-16-744Corporate Address:Dronning Eufemias Gate 300191 Oslo, NorwaySumitomo Mitsui BankPresident and CEO Takeshi KunibeCorporate Office:1-1-2, Marunouchi, Chiyoda-kuTokyo, Japan81-3-3282-8111U.S. Office:277 Park AvenueNew York, NY 10172212-224-4000Royal Bank of CanadaCEO David I. McKayCEO and Board Communications:Paul Frenchpaul.french@rbc.com416-974-3718Corporate Media Relations:Catherine Hudoncatherine.hudon@rbc.com416-974-5506Corporate Address:200 Bay Street P.O. Box 1Royal Bank PlazaToronto, Canada416-974-5151 and 416-842-2000UBSCEO Sergio Ermottihttps://www.linkedin.com/in/sergiopermottiHead Group External Communications:Mark Hengelmark.hengel@ubs.comPhone: 41-44-234-32-21Chief Communication Officer-Americas:Marsha Askinsmarsha.askins@ubs.com212-713-6151 office and 917-226-4743 cellCorporate Office:Bahnhofstrasse 45, CH-80988001 Zurich, Switzerland41-44-234-11-11U.S. Office:1285 Avenue of the Americas New York, NY 10019 212-713-2000Goldman SachsChairman and CEO Lloyd C. Blankfeinlloyd.blankfein@gs.com917-743-0939 and 212-902-0593Media Contacts Americas:212-902-5400Corporate Address:Goldman, Sachs & Co.200 West StreetNew York, NY 10282212-902-1000Morgan StanleyCEO James P. Gormanjgorman@morganstanley.com212-761-4000Corporate Office:Morgan Stanley1585 BroadwayNew York, NY 10036212-761-4000Community Trust BankChairman, President, and CEO Jean R. HaleSenior Vice President, Investments: . Christopher Mengmengro@ctbi.com859-389-5300Corporate Office:346 N Mayo TrailPikeville, KY 41501606-432-1414HSBC BankChairman Douglas FlintGroup Chief Executive Stuart Gullivermanagingdirectoruk@hsbc.comCorporate Address:8 Canada SquareLondon E14 5HQ, United Kingdom44-20-7991-8888U.S. Office:HSBC Headquarters425 5th AvenueNew York, NY 10018212-525-5600Head of Media Relations, HSBC USA:Rob Sherman212-525-6901The organization's deputy communications director, Seth Gladstone, suggests saying: ""As a customer of your financial institution, I reject the notion of my money helping to support your investment in the Dakota Access pipeline, an inherently dangerous and unjust oil pipeline that threatens air and water quality in many states, and violates sacred lands of the Standing Rock Sioux tribe. I urge you to give up your financial stake in the Dakota Access pipeline immediately.""http://www.commondreams.org/views/2016/10/28/how-contact-17-banks-funding-dakota-access-pipeline",How to Contact the 17 Banks Funding the Dakota Access Pipeline,link,http://www.commondreams.org/views/2016/10/28/how-contact-17-banks-funding-dakota-access-pipeline,11/21/16 12:00,3483,181,3538,3115,155,19,6,18,170,2016-11-21
240944029279128_1370076869699166,"PLEASE CALL THE FOLLOWING AGENCIES NOW!Demand that law enforcement STAND DOWN on Highway 1806. There is no room in a democracy to fire hose, tear gas or use rubber bullets on peaceful, unarmed water protectors.ND Office of the Governor: 701-328-2200Morton County Sheriff's Department: 701-328-8118 & 701-667-3330ND National Guard: 701-333-2000Share this post onto your feed and into alternative media FB groups.https://www.facebook.com/DigitalSmokeSignals/videos/10155452771834746/--BREAKING:Water protectors at Standing Rock are blockading a bridge to stop the Dakota Access Pipeline. It has been reported that the police are attacking them with tear gas, water cannons, noise cannons and rubber bullets. Please share this livestream to your own feed, and into alternative media FB groups.--""The most effective means of showing support for this cause is to actively participate in protecting this sacred land. Anyone who is able to travel to the peaceful encampments is encouraged to do so. For those unable to make the journey to North Dakota, please utilize the alternate methods provided to show your support for the Standing Rock Sioux who have united over 100 tribes from across the U.S. Please join this effort to stop this pipeline, which desecrates sacred lands and has serious potential to damage or destroy the Standing Rock reservations lifeblood â€“ its water.""ACTION STEPS IN SUPPORT OF STANDING ROCK AND OUR UNIVERSAL RIGHTS TO CLEAN WATER:1. Call North Dakota governor Jack Dalrymple at 701-328-2200. When leaving a message, state your thoughts about this subject -- please be professional.2. Sign the petition to the White House to Stop DAPL: https://petitions.whitehouse.gov/petition/stop-construction-dakota-access-pipeline-which-endangers-water-supply-native-american-reservations3. Donate to support the Standing Rock Sioux at http://standingrock.org/4. Donate items from the Sacred Stone Camp Supply List: http://sacredstonecamp.org/supply-list/5. Call the White House at (202) 456-1111 or (202) 456-1414. Tell President Obama to rescind the Army Corps of Engineers' Permit for the Dakota Access Pipeline.6. Contribute to the Sacred Stone Camp Legal Defense Fund: https://fundrazr.com/d19fAf7. Contribute to the Sacred Stone Camp gofundme account: https://www.gofundme.com/sacredstonecamp8. Call the Army Corps of Engineers and demand that they reverse the permit: (202) 761-59039. Sign other petitions asking President Obama to stop the Dakota Access Pipeline. Here's the latest â€“ https://act.credoaction.com/sign/NoDAPL10. Call the executives of the companies that are building the pipeline:a. Lee Hanse Executive Vice President Energy Transfer Partners, L.P. 800 E Sonterra Blvd #400 San Antonio, Texas 78258 Telephone: (210) 403-6455 Lee.Hanse@energytransfer.comb. Glenn Emery Vice President Energy Transfer Partners, L.P. 800 E Sonterra Blvd #400 San Antonio, Texas 78258 Telephone: (210) 403-6762 Glenn.Emery@energytransfer.comc. Michael (Cliff) Waters Lead Analyst Energy Transfer Partners, L.P. 1300 Main St. Houston, Texas 77002 Telephone: (713) 989-2404 Michael.Waters@energytransfer.com11. How To Contact The 17 Banks Funding The Pipeline:http://www.commondreams.org/views/2016/10/28/how-contact-17-banks-funding-dakota-access-pipeline",Digital Smoke Signals,video,https://www.facebook.com/DigitalSmokeSignals/videos/10155452771834746/,11/21/16 0:10,4443,225,5,2639,62,41,2,519,1180,2016-11-21
240944029279128_1369419473098239,"Join me for a conversation with Dr. Margaret Flowers, recent Green Party candidate for US senate in Maryland, on the phenomenal growth of the Green Party in Maryland.#ItsInOurHands #GoGreen",,video,https://www.facebook.com/drjillstein/videos/1369419473098239/,11/20/16 12:19,1127,863,472,825,285,8,3,0,6,2016-11-20
240944029279128_1362470440459809,"Write Brain Studios has produced an incredible docuseries called The Revolution Televised. Each week, they are releasing new episodes about 15 minutes long -- they already have 3 available. Watch them all here: Vid#1: https://www.facebook.com/WriteBrainPresentsTheRevolutionTelevised/videos/1683871568593203/Vid#2: https://vimeo.com/190814852Vid#3: https://vimeo.com/191735214",Timeline Photos,photo,https://www.facebook.com/drjillstein/photos/a.267467419960122.70392.240944029279128/1362470440459809/?type=3,11/20/16 12:00,284,10,89,244,35,4,1,0,0,2016-11-20
240944029279128_1368776459829207,"We must continue to organize and I want to make sure that you feel supported. I know some of you asked to continue our weekly fireside chats and I thought it was important to continue too.Join me for this discussion with Kshama Sawant to help you stand strong in the face of this emergency.#FiresideChat",,video,https://www.facebook.com/drjillstein/videos/1368776459829207/,11/19/16 22:09,1905,1002,730,1361,505,10,5,9,15,2016-11-19
240944029279128_1368443406529179,"My LIVE speech to the IFUT in Seattle, discussing the Middle East",,video,https://www.facebook.com/drjillstein/videos/1368443406529179/,11/19/16 17:42,1420,1003,502,988,392,10,4,5,21,2016-11-19
240944029279128_1362494233790763,"In order to break the 2-party trap, we need Ranked Choice Voting. This voting method erases the whole mentality of voting in fear or against a candidate, but rather in favor of your morals and vision for the country.jill2016.com/RCV",What Is Ranked-Choice Voting?,link,http://jill2016.com/RCV,11/19/16 15:00,2179,108,757,1964,194,6,13,1,1,2016-11-19
240944029279128_1362469147126605,"In case you missed this stream when it was live, I just wanted to re-share it again today. My running mate, Mr. Ajamu Baraka, has some very important words that we must remember as we organize.",Jill Stein,video,https://www.facebook.com/drjillstein/videos/1355450911161762/,11/19/16 12:00,520,26,0,450,65,2,2,0,1,2016-11-19
240944029279128_1362485383791648,#GreenFuture!,Timeline Photos,photo,https://www.facebook.com/drjillstein/photos/a.267467419960122.70392.240944029279128/1362485383791648/?type=3,11/18/16 19:00,2541,57,320,2275,262,1,0,1,2,2016-11-18
240944029279128_1364512520255601,"Working to build a #GreenFuture! If you are with us, join our team.jill2016.com/GreenFuture",Help Us Build A Green Future!,link,http://jill2016.com/GreenFuture,11/18/16 15:00,329,19,67,272,53,3,1,0,0,2016-11-18
240944029279128_1362427063797480,"I know some of our followers might be new to the Green Party, and to my campaign. If you have questions about the platform, this page provides a good reference for answers to some of the most common questions we've gotten. jill2016.com/FAQ",Frequently Asked Questions,link,http://jill2016.com/FAQ,11/18/16 12:00,861,30,152,775,82,3,0,0,1,2016-11-18
240944029279128_1366298523410334,"""The writing's on the wall for the Dakota Access pipeline. People power is winning. The news that DNB has sold its assets and is considering terminating its loans is a victory for the water protectors who are fighting to stop this disaster of a project. All financial institutions with a stake in the pipeline must quickly realize that financing this project is toxic. It would be smart for them to get out ahead of the growing movement of customers looking to divest from banks that finance the destruction of our planet and ignore Indigenous rights and sovereignty. Citigroup, TD Securities, Wells Fargo, SunTrust, and the other banks backing this project should see this as a sign to get on the right side of history.""Divest from your bank if it's involved in funding the pipeline and help Indigenous water protectors stock up for the winter by donating: ocetisakowincamp.org",Largest bank in Norway pulls its assets in Dakota Access pipeline,link,http://www.kfyrtv.com/content/news/Largest-bank-in-Norway-pulls-its-assets-in-Dakota-Access-pipeline--401768696.html,11/18/16 0:00,15849,290,5526,13820,1816,162,27,9,15,2016-11-18
240944029279128_1363583710348482,"We love lifting up our supporters' voices. If you are a creative activist who wants to help us build this movement with the help of social media, we've now made it easy for you to submit your work. Thank you to all of you who are taking action!Submit your work here: http://www.jill2016.com/create",Jill Stein,video,https://www.facebook.com/drjillstein/videos/1348092455230941/,11/17/16 22:00,442,21,0,388,48,5,0,0,1,2016-11-17
240944029279128_1366193643420822,An exclusive livestream from Green Party 2016 VP Candidate Ajamu Baraka on where we are now and what must be done! And we'll be taking your questions live from the comments.,Ajamu Baraka,video,https://www.facebook.com/drjillstein/videos/1366193643420822/,11/17/16 21:00,1481,1150,703,1123,327,6,4,6,15,2016-11-17
240944029279128_1364513593588827,"This has always been the people-powered campaign. Have some ideas on how to build this movement? We'd love to hear them.jill2016.com/GreenFuture",Help Us Build A Green Future!,link,http://jill2016.com/GreenFuture,11/17/16 19:00,273,33,58,244,27,2,0,0,0,2016-11-17
240944029279128_1365860863454100,"Set a reminder! Ajamu Baraka, Green Party's 2016 vice presidential candidate, will be live tonight at 9PM ET on this Facebook page.",Timeline Photos,photo,https://www.facebook.com/drjillstein/photos/a.267467419960122.70392.240944029279128/1365860863454100/?type=3,11/17/16 15:09,398,14,82,352,43,2,0,0,1,2016-11-17
240944029279128_1362426047130915,"Are you interested in getting involved with the Green Party? Check out some of these GPUS communities. You never know, you might find one you'd like to be a part of.Caucuses: http://www.gp.org/caucusesState Parties: http://www.gp.org/state_parties",Caucuses,link,http://www.gp.org/caucuses,11/17/16 12:00,460,32,81,427,30,3,0,0,0,2016-11-17
240944029279128_1364669163573270,"This is a win for the people, not Donald Trump. ""Activists celebrated the announcement from Congressional leaders that the Trans-Pacific Partnership, a highly unpopular corporate trade agreement, would not be acted upon by legislators during the lame-duck session of Congress. Senate majority leader Mitch McConnell said the Senate would not act upon it, and House Speaker Paul Ryan admitted they did not have the votes for the deal to pass in the House.""","""Death"" of Trans-Pacific Partnership Declared a Victory for People Power",link,http://www.jill2016.com/tppdeath,11/17/16 10:00,4538,168,865,4069,417,39,12,0,1,2016-11-17
240944029279128_1364853560221497,"David Cobb, the Stein/Baraka campaign manager, has a special livestream announcement planned for our Facebook followers. Come listen in...",,video,https://www.facebook.com/drjillstein/videos/1364853560221497/,11/16/16 21:01,2166,3429,803,1464,649,21,13,5,14,2016-11-16
240944029279128_1363594330347420,"""As news of Hillary Clinton's shocking loss sinks in, many Clinton supporters looking for someone to blame are pointing fingers at a familiar scapegoat: people who voted outside the two-party system.Pundits are already trying to blame Libertarian Gary Johnson and me, the Green party candidate, for Trump's win. For example, MSNBC's Rachel Maddow concocted a scenario in which by taking every Stein vote and half of Johnson's votes, Clinton could have grabbed enough states from Trump to eke out an electoral college win, a story repeated by CNN. Unwilling to accept that Clinton didn't motivate enough voters to win the presidency, and explore the reasons why, many pundits are instead looking to put responsibility for the loss onto others.In Maddow's fantasy, where Johnson drops and Clinton inherits half of Libertarian voters, where does the other half go? In reality, exit polls showed that only 25% of Johnson and Stein voters preferred Clinton to 14-15% who preferred Trump, while the majority â€“ 55% of Johnson voters and 61% of Stein voters â€“ simply wouldn't have voted for either. If we were barred from running, Clinton might have gained a net 10-11% of those voters, but still lost solidly.But these hypotheticals are delusional. Candidates can't snap their fingers and make their supporters vote for someone else they don't support. Pundits may think their favored party is entitled to those votes, but actual voters make their own decisions. No candidate owns anyone's vote â€“ votes have to be earned.Looking for scapegoats is a way to avoid reflection, criticism and accountability after failure. Those who claimed that Clinton was more electable than Bernie Sanders, despite his stronger polling against Trump, are now desperately trying to spin the failure of their strategy.Corporate media gives alternative parties just a tiny fraction of their election coverage. When we do get covered, smear campaigns and ""spoiler"" charges dominate the discussion. Incredibly, pundits justify our exclusion from the airwaves and debates by saying we aren't a factor â€“ yet after election day they declare us the most important factor.Calling anyone outside the two-party system a ""spoiler"" with no right to run is anti-democratic. It suppresses political competition, discourages citizen participation in democracy and shields the toxic two-party system from criticism or reform.Alternative party voters don't consider it ""pragmatic"" to perpetuate a two-party system that keeps getting worse. Many of them make deliberate decisions to use their votes to change that system long-term. Yet after making minimal effort to understand these voters, pundits caricature them as selfish idiots, normalizing hateful, bullying behavior and threats towards anyone who steps outside the collapsing two-party box.The American people want more choices, not fewer. Some 57% think a new major party is needed because the establishment parties do such a poor job. 2016 reached a new low with the most disliked candidates in history. If most of us want more choices, shouldn't the media inform us about other candidates on the ballot, instead of attacking them? When can we move past this two-party trap and take our democracy into our own hands?The good news: voters in Maine and elsewhere are tackling the ""spoiler problem"" head on with ranked choice voting. This voting system lets you rank your choices, so if your first choice loses, your vote is automatically reassigned to your second choice. Ranked choice voting empowers you to vote for the candidates who best represent your values. No one can tell you you're ""throwing your vote away"" if you don't vote for the ""lesser evil"" in order to stop the candidate you fear most. Ranked choice voting also rewards both candidates and voters who find common ground with opponents, rather than slamming them with negative attacks.So are the runner-ups of this bitter election merely looking for a scapegoat, or are they willing to work constructively to fix systemic problems? The very fact that the political and media establishment was able to ram two historically unpopular candidates down our collective throats exposes a critical need for greater democracy. Ranked choice voting is an obvious first step.It's said that those who fail to learn from history are doomed to repeat its mistakes. So the real question is: who's ready to join us and get to work fixing our broken electoral system?""For more information on Ranked Choice Voting: jill2016.com/RCV",Looking for someone to blame? It's not third parties.,link,https://www.theguardian.com/commentisfree/2016/nov/15/blame-for-us-election-outcome-not-third-parties-jill-stein?CMP=Share_iOSApp_Other,11/16/16 19:15,7798,731,2444,6663,821,26,59,22,207,2016-11-16
240944029279128_1364674630239390,"""The Stein/Baraka campaign expresses outrage at the horrific attacks and threats that have been leveled at communities that are in the crosshairs of a Trump presidency. We want to acknowledge the real heartache, pain and worry that people of color, women, immigrants, Muslims, LGBTQIA+, poor and working people are feeling.We also wish to express our deep sorrow and outrage at the attacks that many Green Party supporters have been subjected to for months, and even more intensely in the last few days. Our supporters, friends and staff have reported being subjected to a steady stream of harassment, abuse and threats, up to and including death threats.These attacks have not only come from the virulent, racist ranks of Trump supporters, but have also come in large part from Clinton supporters who seem to think it's okay to vilify, swear at, spit on and make threats against those who disagree; those who choose to exercise their right to vote how they see fit; those who have made the decision that the two-party system itself is the problem.Hateful behavior, from wherever it comes from across the political spectrum, must be seen and called out for what it is: deplorable.We must recognize that many people around this country do not feel safe. We must stand with people of color, with immigrants and Indigenous people, with Muslims, Jews, LGBTQIA+ people, women, and all whose rights are threatened. Solidarity must be our guiding principle.We are committed to peaceful, non-violent actions to oppose the racist, sexist, homophobic, and other harmful acts enacted or inspired by a Trump presidency, and provide real protection and support for people of color and communities that come under threat. We also stand with Greens around the country and the world who have endured bullying and threats for having the courage of their convictions to stand up against the establishment and corporate two-party rule.The Stein/Baraka ticket ran a principled campaign that unapologetically stood with marginalized peoples and their struggles around this country. We will stand firm with these communities against all attacks, as well as with our supporters who have stood with us in this dark time. We will stand firm for a truly progressive agenda to put people, planet and peace over profit - the only counterweight to the rising wave of right-wing extremism in the United States and the world.We must stand with each other, take care of each other, and give ourselves the collective strength and support to build our political power. We are the ones we've been waiting for.""http://www.jill2016.com/solidarity",We Stand With You: Stein/Baraka Campaign In Solidarity With Communities Under Threat,link,http://www.jill2016.com/solidarity,11/16/16 17:31,977,69,184,810,142,3,1,17,4,2016-11-16
240944029279128_1362484467125073,"If you are curious about ways to start getting involved in the Green Party, consider joining your state party or a GPUS Identity Caucus!State Party: http://www.gp.org/state_partiesCaucus: http://www.gp.org/caucuses",Consider Joining Your State Party or a GPUS Identity Caucus!,link,http://www.gp.org/state_parties,11/16/16 15:00,921,37,222,844,68,6,3,0,0,2016-11-16
240944029279128_1362496767123843,"Have you heard of Ranked Choice Voting? Voters just passed it statewide in Maine. We believe RCV is the key to breaking a 2-party oligarchy.Find out more by visit: jill2016.com/RCV",What Is Ranked-Choice Voting?,link,http://jill2016.com/RCV,11/16/16 12:00,9541,302,3690,8581,854,92,9,2,3,2016-11-16
240944029279128_1363797416993778,"Write Brain Studios has just released the 3rd episode of their excellent docuseries, The Revolution Televised. This episode is called: Black Lives Matter. If this is your first time learning about this docuseries, definitely check out their Facebook page and start with episode 1.",The Revolution Televised,video,https://vimeo.com/191735214,11/15/16 21:16,303,9,0,255,41,4,1,1,1,2016-11-15
240944029279128_1362499507123569,"An incredible interview with my running mate, Ajamu Baraka, and Rising up With Sonali discussing more about why liberals are blaming the Green Party for Trump.",Why Are Liberals Blaming The Green Party For Trump?,link,http://www.risingupwithsonali.com/why-are-liberals-blaming-the-green-party-for-trump/,11/15/16 19:00,2183,587,374,1695,67,35,212,22,152,2016-11-15
240944029279128_1363609690345884,My interview with Marc Lamont Hill on #BlackLivesMatter and how we all must work in solidarity with communities of color who are under threat.,Marc Lamont Hill With Dr. Jill Stein,video,https://www.facebook.com/drjillstein/videos/1363609690345884/,11/15/16 16:53,1985,847,848,1436,518,8,12,2,9,2016-11-15
240944029279128_1362477797125740,,Timeline Photos,photo,https://www.facebook.com/drjillstein/photos/a.267467419960122.70392.240944029279128/1362477797125740/?type=3,11/15/16 15:00,2035,65,163,1764,262,5,3,0,1,2016-11-15
240944029279128_1362424630464390,"It is imperative that we keep fighting and building to put people, planet, and peace over profit.We learned in 2016 that a revolution needs a revolutionary party. Help us channel this momentum into building an electoral arm of the peace, democracy, ecology, and social justice movements.jill2016.com/GreenFuture",Help Build A Green Future,link,http://jill2016.com/GreenFuture,11/15/16 12:00,1326,40,231,1180,138,6,1,0,1,2016-11-15
240944029279128_1362507780456075,"Join me in a discussion to keep us standing strong for an America and a world that works for all of us. We must continue to unite and fight, and build resistance to Trump and the failed two-party system. We are the unspoilers in a rotten election system! I'll be answering your questions, so be sure to leave them in the comments.",Jill Stein's Post-Election Analysis,video,https://www.facebook.com/drjillstein/videos/1362507780456075/,11/14/16 21:12,7704,8353,2330,4820,2569,39,85,38,153,2016-11-14
240944029279128_1362195300487323,"Do you have questions for me? Or maybe questions about the Green Party in general? List them in the comments below because I'd love to answer them on our next Fireside chat.Also, join me tonight at 9PM ET for a special livestream event where I'll be discussing some post-election thoughts.",Timeline Photos,photo,https://www.facebook.com/drjillstein/photos/a.267467419960122.70392.240944029279128/1362195300487323/?type=3,11/14/16 18:30,854,374,169,733,113,5,0,1,2,2016-11-14
240944029279128_1362190220487831,"Have you downloaded your free Green New Deal PDF?The Green New Deal will guarantee full employment and generate up to 20 million new, living-wage jobs, as well as make the government the employer of last resort with a much-needed major public jobs program.  http://www.jill2016.com/GreenNewDeal",The Green New Deal,link,http://www.jill2016.com/GreenNewDeal,11/14/16 16:45,628,32,170,547,73,5,3,0,0,2016-11-14
240944029279128_1361867790520074,"Donald Trump did not stop the TPP. We the People Rising Flushed the TPP.We call for a stop to all rigged corporate coup trade deals. We demand putting people and planet over profits.https://www.facebook.com/FlushTheTpp/videos/717048151780083/",Flush the TPP,video,https://www.facebook.com/FlushTheTpp/videos/717048151780083/,11/14/16 11:49,1278,71,0,1138,118,12,5,2,3,2016-11-14
240944029279128_1360317187341801,"My interview with Kevin Zeese LIVE from an action camp how we were able to #FlushTheTPP and challenge corporate power!Here is the schedule for No Lame Duck:http://www.flushthetpp.org/schedule-for-lame-duck-uprising/",Kevin Zeese and Jill Stein,video,https://www.facebook.com/drjillstein/videos/1360317187341801/,11/13/16 13:12,2787,2732,1370,1907,814,33,10,7,16,2016-11-13
240944029279128_1359084250798428,"""The future belongs to those who prepare for it today."" -- Malcolm XWant to learn more about getting involved? Help us build a Green future!jill2016.com/GreenFuture",Timeline Photos,photo,https://www.facebook.com/drjillstein/photos/a.267467419960122.70392.240944029279128/1359084250798428/?type=3,11/12/16 14:45,1712,70,296,1509,195,8,0,0,0,2016-11-12
240944029279128_1358097064230480,"After gaining ballot access in 12 more statesâ€”thanks to petitioning and election winsâ€”the Green Party is now on the ballot in 21 states! Get involved in your state Green Party to grow a movement for the 99 percent: jill2016.com/greenfuture",Timeline Photos,photo,https://www.facebook.com/drjillstein/photos/a.267467419960122.70392.240944029279128/1358097064230480/?type=3,11/11/16 19:00,4243,133,488,3659,540,30,8,2,4,2016-11-11
240944029279128_1358057484234438,"Congratulations to Benton County, Oregon, and the state of Maine for enacting Ranked Choice Voting. This voting process liberates voters who worry about the ""spoiler"" effect. Learn more: jill2016.com/rcv",Timeline Photos,photo,https://www.facebook.com/drjillstein/photos/a.267467419960122.70392.240944029279128/1358057484234438/?type=3,11/11/16 15:32,4508,70,742,4000,454,51,2,0,1,2016-11-11
240944029279128_1357868224253364,"Here's episode two of the docuseries Viggo Mortensen narrated.If you'd like to build a party for the 99 percent, visit jill2016.com/greenfuture",The Revolution Televised Episode 2: March on the DNC,video,https://vimeo.com/190814852,11/11/16 11:51,556,42,155,478,67,10,1,0,0,2016-11-11
240944029279128_1357151560991697,Green Party National Co-Chair Andrea MÃ©rida Cuellar is live to talk about her experience offering support to NoDAPL water protectors.,Standing Rock Report,video,https://www.facebook.com/drjillstein/videos/1357151560991697/,11/10/16 21:01,2301,1656,853,1501,724,15,10,41,10,2016-11-10
240944029279128_1356774291029424,"Green Party candidates in California, Florida, Michigan and Minnesota won local seats! Learn more about these candidates: gp.org/election_night_results",Timeline Photos,photo,https://www.facebook.com/drjillstein/photos/a.267467419960122.70392.240944029279128/1356774291029424/?type=3,11/10/16 19:00,17230,328,2474,14887,2194,129,11,4,5,2016-11-10
240944029279128_1356615327711987,"My running mate, Ajamu Baraka, supports Cooperation Jackson, an emerging vehicle for sustainable community development, economic democracy, and community ownership for Black and Brown people. Learn more: cooperationjackson.org",Ajamu Baraka Supports Cooperation Jackson,video,https://www.facebook.com/drjillstein/videos/1356615327711987/,11/10/16 16:00,698,39,143,616,76,5,0,0,1,2016-11-10
240944029279128_1356451007728419,"Is the corporatist, militarist, imperialist two-party tyranny not cutting it for you? Take action to build a party for the 99 percent. #GreenFuture",Help Us Build a Green Future,link,http://jill2016.com/greenfuture,11/10/16 13:00,2177,67,392,1962,197,5,3,7,3,2016-11-10
240944029279128_1355787867794733,"""We have before us the glorious opportunity to inject a new dimension of love into the veins of our civilization."" -- Martin Luther King, Jr.Find out how to build a movement for the 99 percent: jill2016.com/greenfuture",Timeline Photos,photo,https://www.facebook.com/drjillstein/photos/a.267467419960122.70392.240944029279128/1355787867794733/?type=3,11/9/16 19:28,2385,124,578,1962,401,8,3,5,6,2016-11-09
